CVE,CVSS3,EPSS,Description
CVE-2020-11651,9.8,0.97493,"SaltStack Salt contains an authentication bypass vulnerability in the salt-master process ClearFuncs due to improperly validating method calls. The vulnerability allows a remote user to access some methods without authentication, which can be used to retrieve user tokens from the salt master and/or run commands on salt minions. Salt users who follow fundamental internet security guidelines and best practices are not affected by this vulnerability."
CVE-2020-16846,9.8,0.97514,SaltStack Salt allows an unauthenticated user with network access to the Salt API to use shell injections to run code on the Salt API using the SSH client. This vulnerability affects any users running the Salt API.
CVE-2018-2380,6.6,0.0279,SAP Customer Relationship Management (CRM) contains a path traversal vulnerability that allows an attacker to exploit insufficient validation of path information provided by users.
CVE-2010-5326,10.0,0.13576,"SAP NetWeaver Application Server Java Platforms Invoker Servlet does not require authentication, allowing for remote code execution via a HTTP or HTTPS request."
CVE-2016-9563,6.5,0.91883,"SAP NetWeaver Application Server Java Platforms contains an unspecified vulnerability in BC-BMT-BPM-DSK which allows remote, authenticated users to conduct XML External Entity (XXE) attacks."
CVE-2020-6287,10.0,0.97519,SAP NetWeaver Application Server Java Platforms contains a missing authentication for critical function vulnerability allowing unauthenticated access to execute configuration tasks and create administrative users.
CVE-2020-6207,9.8,0.97456,SAP Solution Manager User Experience Monitoring contains a missing authentication for critical function vulnerability which results in complete compromise of all SMDAgents connected to the Solution Manager.
CVE-2016-3976,7.5,0.97431,SAP NetWeaver Application Server Java Platforms contains a directory traversal vulnerability via a ..\ (dot dot backslash) in the fileName parameter to CrashFileDownloadServlet. This allows remote attackers to read files.
CVE-2019-16256,9.8,0.01691,SIMalliance Toolbox Browser contains an command injection vulnerability that could allow remote attackers to retrieve location and IMEI information or execute a range of other attacks by modifying the attack message.
CVE-2020-10148,9.8,0.97324,SolarWinds Orion API contains an authentication bypass vulnerability that could allow a remote attacker to execute API commands.
CVE-2021-35211,10.0,0.94391,SolarWinds Serv-U contains an unspecified memory escape vulnerability which can allow for remote code execution.
CVE-2016-3643,7.8,0.00123,SolarWinds Virtualization Manager allows for privilege escalation through leveraging a misconfiguration of sudo.
CVE-2020-10199,8.8,0.9731,Sonatype Nexus Repository contains an unspecified vulnerability which allows for remote code execution.
CVE-2021-20021,9.8,0.00624,SonicWall Email Security contains an improper privilege management vulnerability which allows an attacker to create an administrative account by sending a crafted HTTP request to the remote host. This vulnerability has known usage in a SonicWall Email Security exploit chain along with CVE-2021-20022 and CVE-2021-20023 to achieve privilege escalation.
CVE-2019-7481,7.5,0.92137,SonicWall SMA100 contains a SQL injection vulnerability allowing an unauthenticated user to gain read-only access to unauthorized resources.
CVE-2021-20022,7.2,0.0033,SonicWall Email Security contains an unrestricted upload of file with dangerous type vulnerability that allows a post-authenticated attacker to upload a file to the remote host. This vulnerability has known usage in a SonicWall Email Security exploit chain along with CVE-2021-20021 and CVE-2021-20023 to achieve privilege escalation.
CVE-2021-20023,4.9,0.93313,SonicWall Email Security contains a path traversal vulnerability that allows a post-authenticated attacker to read files on the remote host. This vulnerability has known usage in a SonicWall Email Security exploit chain along with CVE-2021-20021 and CVE-2021-20022 to achieve privilege escalation.
CVE-2021-20016,9.8,0.02404,SonicWall SSLVPN SMA100 contains a SQL injection vulnerability which allows remote exploitation for credential access by an unauthenticated attacker.
CVE-2020-12271,9.8,0.01173,"Sophos Firewall operating system (SFOS) firmware contains a SQL injection vulnerability when configured with either the administration (HTTPS) service or the User Portal is exposed on the WAN zone. Successful exploitation may cause remote code execution to exfiltrate usernames and hashed passwords for the local device admin(s), portal admins, and user accounts used for remote access (but not external Active Directory or LDAP passwords)."
CVE-2020-10181,9.8,0.26917,Sumavision Enhanced Multimedia Router (EMR) contains a cross-site request forgery (CSRF) vulnerability allowing the creation of users with elevated privileges as administrator on a device.
CVE-2017-6327,8.8,0.36897,"Symantec Messaging Gateway contains an unspecified vulnerability which can allow for remote code execution. With the ability to perform remote code execution, an attacker may also desire to perform privilege escalating actions."
CVE-2019-18988,7.0,0.00252,"TeamViewer Desktop allows for bypass of remote-login access control because the same AES key is used for different customers' installations. If an attacker were to know this key, they could decrypt protected information stored in registry or configuration files or decryption of the Unattended Access password to the system (which allows for remote login to the system)."
CVE-2017-9248,9.8,0.18573,"Progress Telerik UI for ASP.NET AJAX and Sitefinity have a cryptographic weakness in Telerik.Web.UI.dll that can be exploited to disclose encryption keys (Telerik.Web.UI.DialogParametersEncryptionKey and/or the MachineKey), perform cross-site-scripting (XSS) attacks, compromise the ASP.NET ViewState, and/or upload and download files."
CVE-2021-31755,9.8,0.96795,Tenda AC11 devices contain a stack buffer overflow vulnerability in /goform/setmac which allows attackers to execute code via a crafted post request.
CVE-2020-10987,9.8,0.95938,Tenda AC1900 Router AC15 Model contains an unspecified vulnerability which allows remote attackers to execute system commands via the deviceName POST parameter.
CVE-2018-14558,9.8,0.93619,"Tenda AC7, AC9, and AC10 devices contain a command injection vulnerability due to  the ""formsetUsbUnload"" function executes a dosystemCmd function with untrusted input. Successful exploitation allows an attacker to execute OS commands via a crafted goform/setUsbUnload request."
CVE-2018-20062,9.8,0.96823,"ThinkPHP ""noneCms"" contains an unspecified vulnerability which allows for remote code execution through crafted use of the filter parameter."
CVE-2019-9082,8.8,0.97478,ThinkPHP contains an unspecified vulnerability which allows for remote code execution via public//?s=index/\think\app/invokefunction&function=call_user_func_array&vars[0]=system&vars[1][]= followed by the command.
CVE-2019-18187,7.5,0.09758,"Trend Micro OfficeScan contains a directory traversal vulnerability by extracting files from a zip file to a specific folder on the OfficeScan server, leading to remote code execution."
CVE-2020-8467,8.8,0.01186,Trend Micro Apex One and OfficeScan contain an unspecified vulnerability within a migration tool component that allows for remote code execution.
CVE-2020-8468,8.8,0.00452,"Trend Micro Apex One, OfficeScan, and Worry-Free Business Security agents contain a content validation escape vulnerability that could allow an attacker to manipulate certain agent client components."
CVE-2020-24557,7.8,0.00062,"Trend Micro Apex One, OfficeScan, and Worry-Free Business Security on Microsoft Windows contain an improper access control vulnerability that may allow an attacker to manipulate a particular product folder to disable the security temporarily, abuse a specific Windows function, and attain privilege escalation."
CVE-2020-8599,9.8,0.12239,Trend Micro Apex One and OfficeScan server contain a vulnerable EXE file that could allow a remote attacker to write data to a path on affected installations and bypass root login.
CVE-2021-36742,7.8,0.00137,"Trend Micro Apex One, Apex One as a Service, and Worry-Free Business Security contain an improper input validation vulnerability that allows for privilege escalation."
CVE-2021-36741,8.8,0.01597,"Trend Micro Apex One, Apex One as a Service, and Worry-Free Business Security contain an improper input validation vulnerability that allows a remote attacker to upload files."
CVE-2019-20085,7.5,0.67701,TVT devices utilizing NVMS-1000 software contain a directory traversal vulnerability via GET /.. requests.
CVE-2020-5849,7.5,0.97188,Unraid contains an authentication bypass vulnerability that allows attackers to gain access to the administrative interface. This CVE is chainable with CVE-2020-5847 for remote code execution.
CVE-2020-5847,9.8,0.97113,Unraid contains a vulnerability due to the insecure use of the extract PHP function that can be abused to execute remote code as root. This CVE is chainable with CVE-2020-5849 for initial access.
CVE-2019-16759,9.8,0.97535,The PHP module within vBulletin contains an unspecified vulnerability that allows for remote code execution via the widgetConfig[code] parameter in an ajax/render/widget_php routestring request.
CVE-2020-17496,9.8,0.97475,The PHP module within vBulletin contains an unspecified vulnerability that allows for remote code execution via crafted subWidgets data in an ajax/render/widget_tabbedcontainer_tab_panel request. This CVE ID resolves an incomplete patch for CVE-2019-16759.
CVE-2019-5544,9.8,0.12178,VMware ESXi and Horizon Desktop as a Service (DaaS) OpenSLP contains a heap-based buffer overflow vulnerability that allows an attacker with network access to port 427 to overwrite the heap of the OpenSLP service to perform remote code execution.
CVE-2020-3992,9.8,0.29014,VMware ESXi OpenSLP contains a use-after-free vulnerability that allows an attacker residing in the management network with access to port 427 to perform remote code execution.
CVE-2020-3950,7.8,0.00538,"VMware Fusion, Remote Console (VMRC) for Mac, and Horizon Client for Mac contain a privilege escalation vulnerability due to improper use of setuid binaries that allows attackers to escalate privileges to root."
CVE-2021-22005,9.8,0.97237,VMware vCenter Server contains a file upload vulnerability in the Analytics service that allows a user with network access to port 443 to execute code.
CVE-2020-3952,9.8,0.61756,VMware vCenter Server contains an information disclosure vulnerability in the VMware Directory Service (vmdir) when the Platform Services Controller (PSC) does not correctly implement access controls. Successful exploitation allows an attacker with network access to port 389 to extract sensitive information.
CVE-2021-21972,9.8,0.97432,VMware vCenter Server vSphere Client contains a remote code execution vulnerability in a vCenter Server plugin which allows an attacker with network access to port 443 to execute commands with unrestricted privileges on the underlying operating system.
CVE-2021-21985,9.8,0.97454,"VMware vSphere Client contains an improper input validation vulnerability in the Virtual SAN Health Check plug-in, which is enabled by default in vCenter Server, which allows for remote code execution."
CVE-2020-4006,9.1,0.47822,"VMware Workspace One Access, Access Connector, Identity Manager, and Identity Manager Connector contain a command injection vulnerability. An attacker with network access to the administrative configurator on port 8443 and a valid password for the configurator administrator account can execute commands with unrestricted privileges on the underlying operating system."
CVE-2020-25213,9.8,0.97341,WordPress File Manager plugin contains a remote code execution vulnerability that allows unauthenticated users to execute PHP code and upload malicious files on a target site.
CVE-2020-11738,7.5,0.97211,WordPress Snap Creek Duplicator plugin contains a file download vulnerability when an administrator creates a new copy of their site that allows an attacker to download the generated files from their Wordpress dashboard. This vulnerability affects Duplicator and Dulplicator Pro.
CVE-2019-9978,6.1,0.97338,WordPress Social Warfare plugin contains a cross-site scripting (XSS) vulnerability that allows for remote code execution. This vulnerability affects Social Warfare and Social Warfare Pro.
CVE-2021-27561,9.8,0.97508,Yealink Device Management contains a server-side request forgery (SSRF) vulnerability that allows for unauthenticated remote code execution.
CVE-2021-40539,9.8,0.97492,Zoho ManageEngine ADSelfService Plus contains an authentication bypass vulnerability affecting the REST API URLs which allow for remote code execution.
CVE-2020-10189,9.8,0.9717,Zoho ManageEngine Desktop Central contains a file upload vulnerability that allows for unauthenticated remote code execution.
CVE-2019-8394,6.5,0.96936,Zoho ManageEngine ServiceDesk Plus (SDP) contains an unspecified vulnerability that allows remote users to upload files via login page customization.
CVE-2020-29583,9.8,0.9529,"Zyxel firewalls (ATP, USG, VM) and AP Controllers (NXC2500 and NXC5500) contain a use of hard-coded credentials vulnerability in an undocumented account (""zyfwp"") with an unchangeable password."
CVE-2021-22204,7.8,0.91488,Improper neutralization of user data in the DjVu file format in Exiftool versions 7.44 and up allows arbitrary code execution when parsing the malicious image
CVE-2021-40449,7.8,0.00153,Unspecified vulnerability allows for an authenticated user to escalate privileges.
CVE-2021-42321,8.8,0.95155,An authenticated attacker could leverage improper validation in cmdlet arguments within Microsoft Exchange and perform remote code execution.
CVE-2021-42292,7.8,0.00258,A security feature bypass vulnerability in Microsoft Excel would allow a local user to perform arbitrary code execution.
CVE-2020-11261,7.8,0.00167,"Memory corruption due to improper check to return error when user application requests memory allocation of a huge size in Snapdragon Auto, Snapdragon Compute, Snapdragon Connectivity, Snapdragon Consumer IOT, Snapdragon Industrial IOT, Snapdragon Mobile, Snapdragon Voice & Music, Snapdragon Wearables"
CVE-2018-14847,9.1,0.97471,MikroTik RouterOS through 6.42 allows unauthenticated remote attackers to read arbitrary files and remote authenticated attackers to write arbitrary files due to a directory traversal vulnerability in the WinBox interface.
CVE-2021-37415,9.8,0.95802,Zoho ManageEngine ServiceDesk Plus before 11302 is vulnerable to authentication bypass that allows a few REST-API URLs without authentication
CVE-2021-40438,9.0,0.97515,A crafted request uri-path can cause mod_proxy to forward the request to an origin server choosen by the remote user. This issue affects Apache HTTP Server 2.4.48 and earlier.
CVE-2021-44077,9.8,0.97396,"Zoho ManageEngine ServiceDesk Plus before 11306, ServiceDesk Plus MSP before 10530, and SupportCenter Plus before 11014 are vulnerable to unauthenticated remote code execution"
CVE-2021-44515,9.8,0.97494,Zoho Desktop Central contains an authentication bypass vulnerability that could allow an attacker to execute arbitrary code in the Desktop Central MSP server.
CVE-2019-13272,7.8,0.00052,Kernel/ptrace.c in Linux kernel mishandles contains an improper privilege management vulnerability which allows local users to obtain root access.
CVE-2021-35394,9.8,0.96893,RealTek Jungle SDK contains multiple memory corruption vulnerabilities which can allow an attacker to perform remote code execution.
CVE-2019-7238,9.8,0.97478,Sonatype Nexus Repository Manager before 3.15.0 has an incorrect access control vulnerability. Exploitation allows for remote code execution.
CVE-2019-0193,7.2,0.95869,The optional Apache Solr module DataImportHandler contains a code injection vulnerability.
CVE-2021-44168,7.8,0.00122,"Fortinet FortiOS ""execute restore src-vis"" downloads code without integrity checking, allowing an attacker to arbitrarily download files."
CVE-2017-17562,8.1,0.9747,Embedthis GoAhead before 3.6.5 allows remote code execution if CGI is enabled and a CGI program is dynamically linked.
CVE-2017-12149,9.8,0.9719,"The JBoss Application Server, shipped with Red Hat Enterprise Application Platform 5.2, allows an attacker to execute arbitrary code via crafted serialized data."
CVE-2010-1871,,0.96496,"JBoss Seam 2 (jboss-seam2), as used in JBoss Enterprise Application Platform 4.3.0 for Red Hat Linux, allows attackers to perform remote code execution. This vulnerability can only be exploited when the Java Security Manager is not properly configured."
CVE-2020-17463,9.8,0.89083,"FUEL CMS 1.4.7 allows SQL Injection via the col parameter to /pages/items, /permissions/items, or /navigation/items."
CVE-2020-8816,7.2,0.94173,Pi-hole Web v4.3.2 (aka AdminLTE) allows Remote Code Execution by privileged dashboard users via a crafted DHCP static lease.
CVE-2019-10758,9.9,0.9739,mongo-express before 0.54.0 is vulnerable to Remote Code Execution via endpoints that uses the `toBSON` method.
CVE-2021-44228,10.0,0.97566,"Apache Log4j2 contains a vulnerability where JNDI features do not protect against attacker-controlled JNDI-related endpoints, allowing for remote code execution."
CVE-2021-43890,7.1,0.00251,"Microsoft Windows AppX Installer contains a spoofing vulnerability which has a high impacts to confidentiality, integrity, and availability."
CVE-2021-4102,8.8,0.05619,Google Chromium V8 Engine contains a use-after-free vulnerability which can allow a remote attacker to execute arbitrary code on the target system.
CVE-2021-22017,5.3,0.16129,Rhttproxy as used in vCenter Server contains a vulnerability due to improper implementation of URI normalization.
CVE-2021-36260,9.8,0.97514,A command injection vulnerability in the web server of some Hikvision product. Due to the insufficient input validation.
CVE-2020-6572,8.8,0.00543,Use-after-free vulnerability in Media in Google Chrome prior to 81.0.4044.92 allowed a Remote attacker to execute arbitrary code via a crafted HTML page.
CVE-2019-1458,7.8,0.97369,"A privilege escalation vulnerability exists in Windows when the Win32k component fails to properly handle objects in memory, aka 'Win32k EoP."
CVE-2013-3900,,0.41534,A remote code execution vulnerability exists in the way that the WinVerifyTrust function handles Windows Authenticode signature verification for PE files.
CVE-2019-2725,9.8,0.97576,Injection vulnerability in the Oracle WebLogic Server component of Oracle Fusion Middleware (subcomponent: Web Services).
CVE-2019-9670,9.8,0.97513,Improper Restriction of XML External Entity Reference vulnerability affecting Synacor Zimbra Collaboration (ZCS).
CVE-2018-13382,7.5,0.89573,An Improper Authorization vulnerability in Fortinet FortiOS and FortiProxy under SSL VPN web portal allows an unauthenticated attacker to modify the password.
CVE-2018-13383,6.5,0.00817,A heap buffer overflow in Fortinet FortiOS and FortiProxy may cause the SSL VPN web service termination for logged in users.
CVE-2019-1579,8.1,0.96676,Remote Code Execution in PAN-OS with GlobalProtect Portal or GlobalProtect Gateway Interface enabled.
CVE-2019-10149,9.8,0.97436,Improper validation of recipient address in deliver_message() function in /src/deliver.c may lead to remote command execution.
CVE-2015-7450,9.8,0.9741,"Serialized-object interfaces in certain IBM analytics, business solutions, cognitive, IT infrastructure, and mobile and social products allow remote attackers to execute arbitrary commands"
CVE-2017-1000486,9.8,0.96992,Primetek Primefaces is vulnerable to a weak encryption flaw resulting in remote code execution
CVE-2019-7609,10.0,0.97137,Kibana contain an arbitrary code execution flaw in the Timelion visualizer.
CVE-2021-27860,8.8,0.05312,"A vulnerability in the web management interface of FatPipe WARP, IPVPN, and MPVPN software allows a remote, unauthenticated attacker to upload a file to any location on the filesystem."
CVE-2021-32648,9.1,0.02064,In affected versions of the october/system package an attacker can request an account password reset and then gain access to the account using a specially crafted request.
CVE-2021-25296,8.8,0.89404,Nagios XI contains a vulnerability which can lead to OS command injection on the Nagios XI server.
CVE-2021-25297,8.8,0.89404,Nagios XI contains a vulnerability which can lead to OS command injection on the Nagios XI server.
CVE-2021-25298,8.8,0.97378,Nagios XI contains a vulnerability which can lead to OS command injection on the Nagios XI server.
CVE-2021-40870,9.8,0.95606,"Unrestricted upload of a file with a dangerous type is possible, which allows an unauthenticated user to execute arbitrary code via directory traversal."
CVE-2021-33766,7.5,0.93055,Microsoft Exchange Server contains an information disclosure vulnerability which can allow an unauthenticated attacker to steal email traffic from target.
CVE-2021-21975,7.5,0.97464,Server Side Request Forgery (SSRF) in vRealize Operations Manager API prior to 8.4 may allow a malicious actor with network access to the vRealize Operations Manager API to perform a SSRF attack to steal administrative credentials.
CVE-2021-21315,7.8,0.97241,"In this vulnerability, an attacker can send a malicious payload that will exploit the name parameter. After successful exploitation, attackers can execute remote."
CVE-2021-22991,9.8,0.76152,"The Traffic Management Microkernel of BIG-IP ASM Risk Engine has a buffer overflow vulnerability, leading to a bypassing of URL-based access controls."
CVE-2020-14864,7.5,0.32452,"Path traversal vulnerability, where an attacker can target the preview FilePath parameter of the getPreviewImage function to get access to arbitrary system file."
CVE-2020-13671,8.8,0.01265,Improper sanitization in the extension file names is present in Drupal core.
CVE-2020-11978,8.8,0.97524,A remote code/command injection vulnerability was discovered in one of the example DAGs shipped with Airflow.
CVE-2020-13927,9.8,0.94559,The previous default setting for Airflow's Experimental API was to allow all API requests without authentication.
CVE-2006-1547,,0.0176,ActionForm in Apache Struts versions before 1.2.9 with BeanUtils 1.7 contains a vulnerability which allows for denial-of-service.
CVE-2012-0391,,0.15639,The ExceptionDelegator component in Apache Struts 2 before 2.2.3.1 contains an improper input validation vulnerability which allows for remote code execution.
CVE-2018-8453,7.8,0.94764,Microsoft Windows Win32k contains a vulnerability which allows an attacker to escalate privileges.
CVE-2021-35247,5.3,0.00377,SolarWinds Serv-U versions 15.2.5 and earlier contain an improper input validation vulnerability which allows attackers to build and send queries without sanitization.
CVE-2022-22587,9.8,0.00208,Apple IOMobileFrameBuffer contains a memory corruption vulnerability which can allow a malicious application to execute arbitrary code with kernel privileges.
CVE-2021-20038,9.8,0.96126,SonicWall SMA 100 devies are vulnerable to an unauthenticated stack-based buffer overflow vulnerability where exploitation can result in code execution.
CVE-2020-5722,9.8,0.97497,Grandstream UCM6200 series is vulnerable to an unauthenticated remote SQL injection via crafted HTTP request. Exploitation can allow for code execution as root.
CVE-2020-0787,7.8,0.00177,Microsoft Windows BITS is vulnerable to to a privilege elevation vulnerability if it improperly handles symbolic links. An actor can exploit this vulnerability to execute arbitrary code with system-level privileges.
CVE-2017-5689,9.8,0.97416,Intel products contain a vulnerability which can allow attackers to perform privilege escalation.
CVE-2014-1776,,0.97312,Microsoft Internet Explorer contains a memory corruption vulnerability that allows remote attackers to execute code in the context of the current user.
CVE-2014-6271,9.8,0.97566,"GNU Bash through 4.3 processes trailing strings after function definitions in the values of environment variables, which allows remote attackers to execute code."
CVE-2014-7169,,0.97348,"GNU Bash through 4.3 processes trailing strings after function definitions in the values of environment variables, which allows remote attackers to execute code. This CVE correctly remediates the vulnerability in CVE-2014-6271."
CVE-2022-21882,7.8,0.01799,Microsoft Win32k contains an unspecified vulnerability which allows for privilege escalation.
CVE-2021-36934,7.8,0.00087,"If a Volume Shadow Copy (VSS) shadow copy of the system drive is available, users can read the SAM file which would allow any user to escalate privileges to SYSTEM level."
CVE-2020-0796,10.0,0.97434,A remote code execution vulnerability exists in the way that the Microsoft Server Message Block 3.1.1 (SMBv3) protocol handles certain requests. An attacker who successfully exploited the vulnerability could gain the ability to execute code on the target server or client.
CVE-2018-1000861,9.8,0.97412,A code execution vulnerability exists in the Stapler web framework used by Jenkins
CVE-2017-9791,9.8,0.97464,The Struts 1 plugin in Apache Struts might allow remote code execution via a malicious field value passed in a raw message to the ActionMessage.
CVE-2017-8464,8.8,0.97456,Windows Shell in multiple versions of Microsoft Windows allows local users or remote attackers to execute arbitrary code via a crafted .LNK file
CVE-2017-10271,7.5,0.97438,Oracle Corporation WebLogic Server contains a vulnerability that allows for remote code execution.
CVE-2017-0263,7.8,0.00531,Microsoft Win32k contains a privilege escalation vulnerability due to the Windows kernel-mode driver failing to properly handle objects in memory.
