CVE,CVSS3,EPSS,Description
CVE-2021-27104,9.8,0.01059,Accellion FTA contains an OS command injection vulnerability exploited via a crafted POST request to various admin endpoints.
CVE-2021-27102,7.8,0.00083,Accellion FTA contains an OS command injection vulnerability exploited via a local web service call.
CVE-2021-27101,9.8,0.00731,Accellion FTA contains a SQL injection vulnerability exploited via a crafted host header in a request to document_root.html.
CVE-2021-27103,9.8,0.01222,Accellion FTA contains a server-side request forgery (SSRF) vulnerability exploited via a crafted POST request to wmProgressstat.html.
CVE-2021-21017,8.8,0.67524,Acrobat Acrobat and Reader contain a heap-based buffer overflow vulnerability that could allow an unauthenticated attacker to achieve code execution in the context of the current user.
CVE-2021-28550,8.8,0.67482,Adobe Acrobat and Reader contains a use-after-free vulnerability that could allow an unauthenticated attacker to achieve code execution in the context of the current user.
CVE-2018-4939,9.8,0.97236,Adobe ColdFusion contains a deserialization of untrusted data vulnerability that could allow for code execution.
CVE-2018-15961,9.8,0.97453,Adobe ColdFusion contains an unrestricted file upload vulnerability that could allow for code execution.
CVE-2018-4878,9.8,0.9742,Adobe Flash Player contains a use-after-free vulnerability that could allow for code execution.
CVE-2020-5735,8.8,0.01927,"Amcrest cameras and NVR contain a stack-based buffer overflow vulnerability through port 37777 that allows an unauthenticated, remote attacker to crash the device and possibly execute code."
CVE-2019-2215,7.8,0.003,"Android Kernel contains a use-after-free vulnerability in binder.c which allows for privilege escalation from an application to the Linux Kernel. This vulnerability was observed chained with CVE-2020-0041 and CVE-2020-0069 under exploit chain ""AbstractEmu."""
CVE-2020-0041,7.8,0.00081,"Android Kernel binder_transaction of binder.c contains an out-of-bounds write vulnerability due to an incorrect bounds check that could allow for local privilege escalation. This vulnerability was observed chained with CVE-2019-2215 and CVE-2020-0069 under exploit chain ""AbstractEmu."""
CVE-2020-0069,7.8,0.00111,"Multiple MediaTek chipsets contain an insufficient input validation vulnerability and have missing SELinux restrictions in the Command Queue drivers ioctl handlers. This causes an out-of-bounds write leading to privilege escalation. This vulnerability was observed chained with CVE-2019-2215 and CVE-2020-0041 under exploit chain ""AbstractEmu."""
CVE-2017-9805,8.1,0.97548,"Apache Struts REST Plugin uses an XStreamHandler with an instance of XStream for deserialization without any type filtering, which can lead to remote code execution when deserializing XML payloads."
CVE-2021-42013,9.8,0.97492,Apache HTTP Server contains a path traversal vulnerability which allows an attacker to perform remote code execution if files outside directories configured by Alias-like directives are not under default ?require all denied? or if CGI scripts are enabled. This CVE ID resolves an incomplete patch for CVE-2021-41773.
CVE-2021-41773,7.5,0.97532,"Apache HTTP Server contains a path traversal vulnerability which allows an attacker to perform remote code execution if files outside directories configured by Alias-like directives are not under default ?require all denied? or if CGI scripts are enabled. The original patch issued under this CVE ID is insufficient, please review remediation information under CVE-2021-42013."
CVE-2019-0211,7.8,0.97436,"Apache HTTP Server, with MPM event, worker or prefork, code executing in less-privileged child processes or threads (including scripts executed by an in-process scripting interpreter) could execute code with the privileges of the parent process (usually root) by manipulating the scoreboard."
CVE-2016-4437,8.1,0.97507,"Apache Shiro contains a vulnerability which may allow remote attackers to execute code or bypass intended access restrictions via an unspecified request parameter when a cipher key has not been configured for the ""remember me"" feature."
CVE-2019-17558,7.5,0.97543,The Apache Solr VelocityResponseWriter plug-in contains an unspecified vulnerability which can allow for remote code execution.
CVE-2020-17530,9.8,0.97161,"Forced Object-Graph Navigation Language (OGNL) evaluation in Apache Struts, when evaluated on raw user input in tag attributes, can lead to remote code execution."
CVE-2017-5638,10.0,0.9756,"Apache Struts Jakarta Multipart parser allows for malicious file upload using the Content-Type value, leading to remote code execution."
CVE-2018-11776,8.1,0.97557,"Apache Struts contains a vulnerability which allows for remote code execution under two circumstances. One, where the alwaysSelectFullNamespace option is true and the value isn't set for a result defined in underlying configurations and in same time, its upper package configuration have no or wildcard namespace.  Or, using URL tag which doesn?t have value and action set and in same time, its upper package configuration have no or wildcard namespace."
CVE-2021-30858,8.8,0.00563,"Apple iOS, iPadOS, and macOS WebKit contains a use-after-free vulnerability that may allow for code execution when processing maliciously crafted web content."
CVE-2019-6223,7.5,0.00678,Apple iOS and macOS Group FaceTime contains an unspecified vulnerability where the call initiator can cause the recipient's Apple device to answer unknowingly or without user interaction.
CVE-2021-30860,7.8,0.00139,"Apple iOS, iPadOS, macOS, and watchOS CoreGraphics contain an integer overflow vulnerability which may allow code execution when processing a maliciously crafted PDF. The vulnerability is also known under the moniker of FORCEDENTRY."
CVE-2020-27930,7.8,0.00192,"Apple iOS, iPadOS, macOS, and watchOS FontParser contain a memory corruption vulnerability which may allow for code execution when processing maliciously crafted front."
CVE-2021-30807,7.8,0.00083,"Apple iOS, iPadOS, macOS, and watchOS IOMobileFrameBuffer contain a memory corruption vulnerability which may allow an application to execute code with kernel privileges."
CVE-2020-27950,5.5,0.00271,"Apple iOS, iPadOS, macOS, and watchOS contain a memory initialization vulnerability that may allow a malicious application to disclose kernel memory."
CVE-2020-27932,7.8,0.00192,"Apple iOS, iPadOS, macOS, and watchOS contain a type confusion vulnerability that may allow a malicious application to execute code with kernel privileges."
CVE-2020-9818,8.8,0.01655,"Apple iOS, iPadOS, and watchOS Mail contains an out-of-bounds write vulnerability which may allow memory modification or application termination when processing a maliciously crafted mail message."
CVE-2020-9819,4.3,0.00443,"Apple iOS, iPadOS, and watchOS Mail contains a memory corruption vulnerability that may allow heap corruption when processing a maliciously crafted mail message."
CVE-2021-30762,8.8,0.00421,Apple iOS WebKit contains a use-after-free vulnerability which may allow for code execution when processing maliciously crafted web content.
CVE-2021-1782,7.0,0.00097,"Apple iOS, iPadOs, macOS, watchOS, and tvOS contain a race condition vulnerability that may allow a malicious application to elevate privileges."
CVE-2021-1870,9.8,0.00405,"Apple iOS, iPadOS, and macOS WebKit contain an unspecified logic issue which may allow a remote attacker to execute code."
CVE-2021-1871,9.8,0.00448,"Apple iOS, iPadOS, and macOS WebKit contain an unspecified logic issue which may allow a remote attacker to execute code."
CVE-2021-1879,6.1,0.00201,"Apple iOS, iPadOS, and watchOS WebKit contains a cross-site scripting (XSS) vulnerability when processing maliciously crafted web content."
CVE-2021-30661,8.8,0.00401,"Apple iOS, iPadOS, macOS, watchOS, tvOS, and Safari WebKit Storage contain a use-after-free vulnerability which may allow for code execution when processing maliciously crafted web content."
CVE-2021-30666,8.8,0.00349,Apple iOS WebKit contains a buffer-overflow vulnerability which may allow for code execution when processing maliciously crafted web content.
CVE-2021-30713,7.8,0.00575,"Apple macOS Transparency, Consent, and Control (TCC) contains an unspecified permissions issue which may allow a malicious application to bypass privacy preferences."
CVE-2021-30657,5.5,0.65683,Apple macOS contains an unspecified logic issue in System Preferences that may allow a malicious application to bypass Gatekeeper checks.
CVE-2021-30665,8.8,0.00291,"Apple iOS, iPadOS, macOS, watchOS, and tvOS WebKit contain a memory corruption vulnerability which may allow for code execution when processing maliciously crafted web content."
CVE-2021-30663,8.8,0.00303,"Apple iOS, iPadOS, macOS, tvOS, and Safari WebKit contain an integer overflow vulnerability which may allow for code execution when processing maliciously crafted web content."
CVE-2021-30761,8.8,0.00421,Apple iOS WebKit contains a memory corruption vulnerability which may allow for code execution when processing maliciously crafted web content.
CVE-2021-30869,7.8,0.00089,"Apple iOS, iPadOS, and macOS contain a type confusion vulnerability in the XNU which may allow a malicious application to execute code with kernel privileges."
CVE-2020-9859,7.8,0.0007,"Apple iOS, iPadOS, macOS, watchOS, and tvOS contain an unspecified vulnerability that may allow an application to execute code with kernel privileges."
CVE-2021-20090,9.8,0.97441,"Arcadyan Buffalo firmware contains a path traversal vulnerability that could allow unauthenticated, remote attackers to bypass authentication and access sensitive information. This vulnerability affects multiple routers across several different vendors."
CVE-2021-27562,5.5,0.95843,"Arm Trusted Firmware contains an out-of-bounds write vulnerability allowing the non-secure (NS) world to trigger a system halt, overwrite secure data, or print out secure data when calling secure functions under the non-secure processing environment (NSPE) handler mode. This vulnerability affects Yealink Device Management servers."
CVE-2021-28664,8.8,0.0042,"Arm Mali Graphics Processing Unit (GPU) kernel driver contains an unspecified vulnerability that may allow a non-privileged user to gain write access to read-only memory, gain root privilege, corrupt memory, and modify the memory of other processes."
CVE-2021-28663,8.8,0.00626,"Arm Mali Graphics Processing Unit (GPU) kernel driver contains a use-after-free vulnerability that may allow a non-privileged user to make improper operations on GPU memory to gain root privilege, and/or disclose information."
CVE-2019-3398,8.8,0.97326,"Atlassian Confluence Server and Data Center contain a path traversal vulnerability in the downloadallattachments resource that may allow a privileged, remote attacker to write files. Exploitation can lead to remote code execution."
CVE-2021-26084,9.8,0.97454,Atlassian Confluence Server and Data Server contain an Object-Graph Navigation Language (OGNL) injection vulnerability that may allow an unauthenticated attacker to execute code.
CVE-2019-11580,9.8,0.97501,Atlassian Crowd and Crowd Data Center contain a remote code execution vulnerability resulting from a pdkinstall development plugin being incorrectly enabled in release builds.
CVE-2019-3396,9.8,0.97462,Atlassian Confluence Server and Data Center contain a server-side template injection vulnerability that may allow an attacker to achieve path traversal and remote code execution.
CVE-2021-42258,9.8,0.97388,"BQE BillQuick Web Suite contains an SQL injection vulnerability when accessing the username parameter that may allow for unauthenticated, remote code execution."
CVE-2020-3452,7.5,0.97534,Cisco Adaptive Security Appliance (ASA) and Firepower Threat Defense (FTD) contain an improper input validation vulnerability when HTTP requests process URLs.  An attacker could exploit this vulnerability by sending a crafted HTTP request containing directory traversal character sequences to an affected device. A successful exploit could allow the attacker to view arbitrary files within the web services file system on the targeted device.
CVE-2020-3580,6.1,0.97233,Cisco Adaptive Security Appliance (ASA) and Firepower Threat Defense (FTD) contain an insufficient input validation vulnerability for user-supplied input by the web services interface.  Successful exploitation could allow an attacker to perform cross-site scripting (XSS) in the context of the interface or access sensitive browser-based information.
CVE-2021-1497,9.8,0.9752,Cisco HyperFlex HX Installer Virtual Machine contains an insufficient input validation vulnerability which could allow an attacker to execute commands on an affected device as the?root?user.
CVE-2021-1498,9.8,0.9752,Cisco HyperFlex HX Installer Virtual Machine contains an insufficient input validation vulnerability which could allow an attacker to execute commands on an affected device as the tomcat8 user.
CVE-2018-0171,9.8,0.85039,"Cisco IOS and IOS XE Software improperly validates packet data, allowing an unauthenticated, remote attacker to trigger a reload of an affected device, cause a denial-of-service (DoS) condition, or perform code execution on the affected device."
CVE-2020-3118,8.8,0.00219,"Cisco IOS XR improperly validates string input from certain fields in Cisco Discovery Protocol messages. Exploitation could allow an unauthenticated, adjacent attacker to execute code with administrative privileges or cause a reload on an affected device."
CVE-2020-3566,7.5,0.00326,"Cisco IOS XR Distance Vector Multicast Routing Protocol (DVMRP) incorrectly handles Internet Group Management Protocol (IGMP) packets. Exploitation could allow an unauthenticated, remote attacker to immediately crash the IGMP process or make it consume available memory and eventually crash."
CVE-2020-3569,7.5,0.00326,"Cisco IOS XR Distance Vector Multicast Routing Protocol (DVMRP) incorrectly handles Internet Group Management Protocol (IGMP) packets. Exploitation could allow an unauthenticated, remote attacker to immediately crash the IGMP process or make it consume available memory and eventually crash."
CVE-2020-3161,9.8,0.01432,Cisco IP Phones contain an improper input validation vulnerability for HTTP requests. Exploitation could allow an attacker to execute code remotely with?root?privileges or cause a denial-of-service condition.
CVE-2019-1653,7.5,0.97571,Cisco Small Business RV320 and RV325 Dual Gigabit WAN VPN Routers contain improper access controls for URLs. Exploitation could allow an attacker to download the router configuration or detailed diagnostic information.
CVE-2018-0296,7.5,0.97452,Cisco Adaptive Security Appliance (ASA) contains an improper input validation vulnerability with HTTP URLs. Exploitation could allow an attacker to cause a denial-of-service condition or information disclosure.
CVE-2019-13608,7.5,0.00625,Citrix StoreFront Server contains an XML External Entity (XXE) processing vulnerability that may allow an unauthenticated attacker to retrieve potentially sensitive information.
CVE-2020-8193,6.5,0.97454,"Citrix ADC, Citrix Gateway, and multiple Citrix SD-WAN WANOP appliance models contain an authorization bypass vulnerability that may allow unauthenticated access to certain URL endpoints. The attacker must have access to the NetScaler IP (NSIP) in order to perform exploitation."
CVE-2020-8195,6.5,0.86942,"Citrix ADC, Citrix Gateway, and multiple Citrix SD-WAN WANOP appliance models contain an information disclosure vulnerability."
CVE-2020-8196,4.3,0.00201,"Citrix ADC, Citrix Gateway, and multiple Citrix SD-WAN WANOP appliance models contain an information disclosure vulnerability."
CVE-2019-19781,9.8,0.9754,"Citrix ADC, Citrix Gateway, and multiple Citrix SD-WAN WANOP appliance models contain an unspecified vulnerability that could allow an unauthenticated attacker to perform code execution."
CVE-2019-11634,9.8,0.02353,Citrix Workspace Application and Receiver for Windows contains remote code execution vulnerability resulting from local drive access preferences not being enforced into the clients' local drives.
CVE-2020-29557,9.8,0.02711,D-Link DIR-825 R1 devices contain a buffer overflow vulnerability in the web interface that may allow for remote code execution.
CVE-2020-25506,9.8,0.97435,D-Link DNS-320 device contains a command injection vulnerability in the sytem_mgr.cgi component that may allow for remote code execution.
CVE-2018-15811,7.5,0.04325,DotNetNuke (DNN) contains an inadequate encryption strength vulnerability resulting from the use of a weak encryption algorithm to protect input parameters.
CVE-2018-18325,7.5,0.04325,DotNetNuke (DNN) contains an inadequate encryption strength vulnerability resulting from the use of a weak encryption algorithm to protect input parameters. This CVE ID resolves an incomplete patch for CVE-2018-15811.
CVE-2017-9822,8.8,0.96927,DotNetNuke (DNN) contains a vulnerability that may allow for remote code execution via cookie deserialization.
CVE-2019-15752,7.8,0.0017,Docker Desktop Community Edition contains a vulnerability that may allow local users to escalate privileges by placing a trojan horse docker-credential-wincred.exe file in %PROGRAMDATA%\DockerDesktop\version-bin\.
CVE-2020-8515,9.8,0.97144,"DrayTek Vigor3900, Vigor2960, and Vigor300B routers contain an unspecified vulnerability which allows for remote code execution."
CVE-2018-7600,9.8,0.97567,"Drupal Core contains a remote code execution vulnerability that could allow an attacker to exploit multiple attack vectors on a Drupal site, resulting in complete site compromise."
CVE-2021-22205,10.0,0.97419,"GitHub Community and Enterprise Editions that utilize the ability to upload images through GitLab Workhorse are vulnerable to remote code execution. Workhorse passes image file extensions through ExifTool, which improperly validates the image files."
CVE-2018-6789,9.8,0.97257,Exim contains a buffer overflow vulnerability in the base64d function part of the SMTP listener that may allow for remote code execution.
CVE-2020-8657,9.8,0.05314,"EyesOfNetwork contains a use of hard-coded credentials vulnerability, as it uses the same API key by default. Exploitation allows an attacker to calculate or guess the admin access token."
CVE-2020-8655,7.8,0.0027,EyesOfNetwork contains an improper privilege management vulnerability that may allow a user to run commands as root via a crafted Nmap Scripting Engine (NSE) script to nmap7.
CVE-2020-5902,9.8,0.97566,F5 BIG-IP Traffic Management User Interface (TMUI) contains a remote code execution vulnerability in undisclosed pages.
CVE-2021-22986,9.8,0.97452,"F5 BIG-IP and BIG-IQ Centralized Management contain a remote code execution vulnerability in the iControl REST interface that allows unauthenticated attackers with network access to execute system commands, create or delete files, and disable services."
CVE-2021-35464,9.8,0.97374,"ForgeRock Access Management (AM) Core Server allows an attacker who sends a specially crafted HTTP request to one of three endpoints (/ccversion/Version, /ccversion/Masthead, or /ccversion/ButtonFrame) to execute code in the context of the current user (unless ForgeRock AM is running as root user, which the vendor does not recommend)."
CVE-2019-5591,6.5,0.00234,Fortinet FortiOS contains a default configuration vulnerability that may allow an unauthenticated attacker on the same subnet to intercept sensitive information by impersonating the Lightweight Directory Access Protocol (LDAP) server.
CVE-2020-12812,9.8,0.00555,Fortinet FortiOS SSL VPN contains an improper authentication vulnerability that may allow a user to login successfully without being prompted for the second factor of authentication (FortiToken) if they change the case in their username.
CVE-2018-13379,9.8,0.97486,Fortinet FortiOS SSL VPN web portal contains a path traversal vulnerability that may allow an unauthenticated attacker to download FortiOS system files through specially crafted HTTP resource requests.
CVE-2020-16010,8.8,0.00328,"Google Chrome for Android contains a heap buffer overflow vulnerability which allows a remote attacker, who had compromised the renderer process, to potentially perform a sandbox escape via a crafted HTML page."
CVE-2020-15999,6.5,0.11292,"Google Chrome uses FreeType, an open-source software library to render fonts, which contains a heap buffer overflow vulnerability in the function Load_SBit_Png when processing PNG images embedded into fonts. This vulnerability is part of an exploit chain with CVE-2020-17087 on Windows and CVE-2020-16010 on Android."
CVE-2021-21166,8.8,0.04201,"Google Chromium contains a race condition vulnerability in audio which allows a remote attacker to potentially exploit heap corruption via a crafted HTML page. This vulnerability affects web browsers that utilize Chromium, including Google Chrome and Microsoft Edge."
CVE-2020-16017,9.6,0.00191,"Google Chrome contains a use-after-free vulnerability within the site isolation component which allows a remote attacker, who had compromised the renderer process, to potentially perform a sandbox escape via a crafted HTML page."
CVE-2021-37976,6.5,0.03035,Google Chromium contains an information disclosure vulnerability within the core memory component which allows a remote attacker to obtain potentially sensitive information from process memory via a crafted HTML page.
CVE-2020-16009,8.8,0.89429,"Google Chromium V8 Engine contains a type confusion vulnerability which allows a remote attacker to potentially exploit heap corruption via a crafted HTML page. This vulnerability affects web browsers that utilize Chromium, including Google Chrome and Microsoft Edge."
CVE-2021-30632,8.8,0.6303,"Google Chromium V8 Engine contains an out-of-bounds write vulnerability which allows a remote attacker to potentially exploit heap corruption via a crafted HTML page. This vulnerability affects web browsers that utilize Chromium, including Google Chrome and Microsoft Edge."
CVE-2020-16013,8.8,0.00518,Google Chromium V8 Engine contains an incorrect implementation vulnerability which allows a remote attacker to potentially exploit heap corruption via a crafted HTML page.
CVE-2021-30633,9.6,0.00275,"Google Chromium Indexed DB API contains a use-after-free vulnerability which allows a remote attacker who had compromised the renderer process to potentially perform a sandbox escape via a crafted HTML page. This vulnerability affects web browsers that utilize Chromium, including Google Chrome and Microsoft Edge."
CVE-2021-21148,8.8,0.01745,"Google Chromium V8 Engine contains a heap buffer overflow vulnerability which allows a remote attacker to potentially exploit heap corruption via a crafted HTML page. This vulnerability affects web browsers that utilize Chromium, including Google Chrome and Microsoft Edge."
CVE-2021-37973,9.6,0.00354,"Google Chromium Portals contains a use-after-free vulnerability which allows a remote attacker, who had compromised the renderer process, to potentially perform a sandbox escape via a crafted HTML page. This vulnerability affects web browsers that utilize Chromium, including Google Chrome and Microsoft Edge."
CVE-2021-30551,8.8,0.33503,"Google Chromium V8 Engine contains a type confusion vulnerability which allows a remote attacker to potentially exploit heap corruption via a crafted HTML page. This vulnerability affects web browsers that utilize Chromium, including Google Chrome and Microsoft Edge."
CVE-2021-37975,8.8,0.36879,"Google Chromium V8 Engine contains a use-after-free vulnerability which allows a remote attacker to potentially exploit heap corruption via a crafted HTML page. This vulnerability affects web browsers that utilize Chromium, including Google Chrome and Microsoft Edge."
CVE-2020-6418,8.8,0.96693,Google Chromium V8 Engine contains a type confusion vulnerability allows a remote attacker to potentially exploit heap corruption via a crafted HTML page.
CVE-2021-30554,8.8,0.0068,"Google Chromium WebGL contains a use-after-free vulnerability which allows a remote attacker to potentially exploit heap corruption via a crafted HTML page. This vulnerability affects web browsers that utilize Chromium, including Google Chrome and Microsoft Edge."
CVE-2021-21206,8.8,0.00879,"Google Chromium Blink contains a use-after-free vulnerability which allows a remote attacker to potentially exploit heap corruption via a crafted HTML page. This vulnerability affects web browsers that utilize Chromium, including Google Chrome and Microsoft Edge."
CVE-2021-38000,6.1,0.00258,"Google Chromium Intents contains an improper input validation vulnerability which allows a remote attacker to arbitrarily browser to a malicious URL via a crafted HTML page. This vulnerability affects web browsers that utilize Chromium, including Google Chrome and Microsoft Edge."
CVE-2021-38003,8.8,0.01335,"Google Chromium V8 Engine has a bug in JSON.stringify where the internal TheHole value can leak to script code causing memory corruption. This vulnerability affects web browsers that utilize Chromium, including Google Chrome and Microsoft Edge."
CVE-2021-21224,8.8,0.96919,"Google Chromium V8 Engine contains a type confusion vulnerability which allows a remote attacker to execute code inside a sandbox via a crafted HTML page. This vulnerability affects web browsers that utilize Chromium, including Google Chrome and Microsoft Edge."
CVE-2021-21193,8.8,0.00659,"Google Chromium Blink contains a use-after-free vulnerability which allows a remote attacker to potentially exploit heap corruption via a crafted HTML page. This vulnerability affects web browsers that utilize Chromium, including Google Chrome and Microsoft Edge."
