CVE,CVSS3,EPSS,EPSS Percentile,Description,Vendor,Product
CVE-2022-24990,7.5,0.94401,0.99969,TerraMaster OS contains a remote command execution vulnerability that allows an unauthenticated user to execute commands on the target endpoint.,TerraMaster,TerraMaster OS
CVE-2023-0669,7.2,0.94364,0.99952,"Fortra (formerly, HelpSystems) GoAnywhere MFT contains a pre-authentication remote code execution vulnerability in the License Response Servlet due to deserializing an attacker-controlled object.",Fortra,GoAnywhere MFT
CVE-2022-21587,9.8,0.94393,0.99966,Oracle E-Business Suite contains an unspecified vulnerability that allows an unauthenticated attacker with network access via HTTP to compromise Oracle Web Applications Desktop Integrator.,Oracle,E-Business Suite
CVE-2023-22952,8.8,0.93756,0.99841,"Multiple SugarCRM products contain a remote code execution vulnerability in the EmailTemplates. Using a specially crafted request, custom PHP code can be injected through the EmailTemplates.",SugarCRM,Multiple Products
CVE-2022-47966,9.8,0.94421,0.99976,"Multiple Zoho ManageEngine products contain an unauthenticated remote code execution vulnerability due to the usage of an outdated third-party dependency, Apache Santuario.",Zoho,ManageEngine
CVE-2022-44877,9.8,0.94434,0.99982,CWP Control Web Panel (formerly CentOS Web Panel) contains an OS command injection vulnerability that allows remote attackers to execute commands via shell metacharacters in the login parameter.,CWP,Control Web Panel
CVE-2022-41080,8.8,0.93743,0.99839,"Microsoft Exchange Server contains an unspecified vulnerability that allows for privilege escalation. This vulnerability is chainable with CVE-2022-41082, which allows for remote code execution.",Microsoft,Exchange Server
CVE-2023-21674,8.8,0.08963,0.92098,Microsoft Windows Advanced Local Procedure Call (ALPC) contains an unspecified vulnerability that allows for privilege escalation.,Microsoft,Windows
CVE-2018-5430,8.8,0.51416,0.97705,"TIBCO JasperReports Server contain a vulnerability which may allow any authenticated user read-only access to the contents of the web application, including key configuration files.",TIBCO,JasperReports
CVE-2018-18809,6.5,0.94093,0.99889,TIBCO JasperReports Library contains a directory-traversal vulnerability that may allow web server users to access contents of the host system.,TIBCO,JasperReports
CVE-2022-42856,8.8,0.0012,0.32284,Apple iOS contains a type confusion vulnerability when processing maliciously crafted web content leading to code execution.,Apple,iOS
CVE-2022-42475,9.8,0.93183,0.99783,"Multiple versions of Fortinet FortiOS SSL-VPN contain a heap-based buffer overflow vulnerability which can allow an unauthenticated, remote attacker to execute arbitrary code or commands via specifically crafted requests.",Fortinet,FortiOS
CVE-2022-44698,5.4,0.89023,0.99477,Microsoft Defender SmartScreen contains a security feature bypass vulnerability that could allow an attacker to evade Mark of the Web (MOTW) defenses via a specially crafted malicious file.,Microsoft,Defender
CVE-2022-27518,9.8,0.11238,0.93094,"Citrix Application Delivery Controller (ADC) and Gateway, when configured with SAML SP or IdP configuration, contain an authentication bypass vulnerability that allows an attacker to execute code as administrator.",Citrix,Application Delivery Controller (ADC) and Gateway
CVE-2022-26500,8.8,0.21993,0.95396,The Veeam Distribution Service in the Backup & Replication application allows unauthenticated users to access internal API functions. A remote attacker can send input to the internal API which may lead to uploading and executing of malicious code.,Veeam,Backup & Replication
CVE-2022-26501,9.8,0.87028,0.99377,The Veeam Distribution Service in the Backup & Replication application allows unauthenticated users to access internal API functions. A remote attacker can send input to the internal API which may lead to uploading and executing of malicious code.,Veeam,Backup & Replication
CVE-2022-4262,8.8,0.02307,0.83832,"Google Chromium V8 Engine contains a type confusion vulnerability that allows a remote attacker to potentially exploit heap corruption via a crafted HTML page. This vulnerability could affect multiple web browsers that utilize Chromium, including, but not limited to, Google Chrome, Microsoft Edge, and Opera.",Google,Chromium V8
CVE-2021-35587,,0.94181,0.99903,Oracle Fusion Middleware Access Manager allows an unauthenticated attacker with network access via HTTP to takeover the Access Manager product.,Oracle,Fusion Middleware
CVE-2022-4135,9.6,0.00132,0.3417,"Google Chromium GPU contains a heap buffer overflow vulnerability that allows a remote attacker, who has compromised the renderer process, to potentially perform a sandbox escape via a crafted HTML page. This vulnerability could affect multiple web browsers that utilize Chromium, including, but not limited to, Google Chrome, Microsoft Edge, and Opera.",Google,Chromium GPU
CVE-2022-41049,5.4,0.29966,0.96334,Microsoft Windows Mark of the Web (MOTW) contains a security feature bypass vulnerability resulting in a limited loss of integrity and availability of security features.,Microsoft,Windows
CVE-2022-41091,5.4,0.05301,0.89452,Microsoft Windows Mark of the Web (MOTW) contains a security feature bypass vulnerability resulting in a limited loss of integrity and availability of security features.,Microsoft,Windows
CVE-2022-41073,7.8,0.00587,0.67869,Microsoft Windows Print Spooler contains an unspecified vulnerability that allows an attacker to gain SYSTEM-level privileges.,Microsoft,Windows
CVE-2022-41125,7.8,0.00704,0.70826,Microsoft Windows Cryptographic Next Generation (CNG) Key Isolation Service contains an unspecified vulnerability that allows an attacker to gain SYSTEM-level privileges.,Microsoft,Windows
CVE-2022-41128,8.8,0.69287,0.98521,Microsoft Windows contains an unspecified vulnerability in the JScript9 scripting language which allows for remote code execution.,Microsoft,Windows
CVE-2021-25337,7.1,0.00516,0.6541,Samsung mobile devices contain an improper access control vulnerability in clipboard service which allows untrusted applications to read or write arbitrary files. This vulnerability was chained with CVE-2021-25369 and CVE-2021-25370.,Samsung,Mobile Devices
CVE-2021-25369,5.5,0.00214,0.44167,Samsung mobile devices using Mali GPU contains an improper access control vulnerability in sec_log file. Exploitation of the vulnerability exposes sensitive kernel information to the userspace. This vulnerability was chained with CVE-2021-25337 and CVE-2021-25370.,Samsung,Mobile Devices
CVE-2021-25370,4.4,0.00879,0.7409,"Samsung mobile devices using Mali GPU contain an incorrect implementation handling file descriptor in dpu driver. This incorrect implementation results in memory corruption, leading to kernel panic. This vulnerability was chained with CVE-2021-25337 and CVE-2021-25369.",Samsung,Mobile Devices
CVE-2022-3723,8.8,0.00465,0.63104,"Google Chromium V8 Engine contains a type confusion vulnerability that allows a remote attacker to potentially exploit heap corruption via a crafted HTML page. This vulnerability could affect multiple web browsers that utilize Chromium, including, but not limited to, Google Chrome, Microsoft Edge, and Opera.",Google,Chromium V8
CVE-2022-42827,7.8,0.00381,0.58454,Apple iOS and iPadOS kernel contain an out-of-bounds write vulnerability which can allow an application to perform code execution with kernel privileges.,Apple,iOS and iPadOS
CVE-2020-3433,7.8,0.06347,0.90429,Cisco AnyConnect Secure Mobility Client for Windows interprocess communication (IPC) channel allows for insufficient validation of resources that are loaded by the application at run time. An attacker with valid credentials on Windows could execute code on the affected machine with SYSTEM privileges.,Cisco,AnyConnect Secure
CVE-2020-3153,6.5,0.41294,0.97184,"Cisco AnyConnect Secure Mobility Client for Windows allows for incorrect handling of directory paths. An attacker with valid credentials on Windows would be able to copy malicious files to arbitrary locations with system level privileges. This could include DLL pre-loading, DLL hijacking, and other related attacks.",Cisco,AnyConnect Secure
CVE-2018-19323,9.8,0.14638,0.94064,"The GPCIDrv and GDrv low-level drivers in GIGABYTE App Center, AORUS Graphics Engine, XTREME Gaming Engine, and OC GURU expose functionality to read and write arbitrary physical memory. This could be leveraged by a local attacker to elevate privileges.",GIGABYTE,Multiple Products
CVE-2018-19322,7.8,0.02943,0.85674,"The GPCIDrv and GDrv low-level drivers in GIGABYTE App Center, AORUS Graphics Engine, XTREME Gaming Engine, and OC GURU II expose functionality to read/write data from/to IO ports. This could be leveraged in a number of ways to ultimately run code with elevated privileges.",GIGABYTE,Multiple Products
CVE-2018-19321,7.8,0.25043,0.95816,"The GPCIDrv and GDrv low-level drivers in GIGABYTE App Center, AORUS Graphics Engine, XTREME Gaming Engine, and OC GURU II expose functionality to read and write arbitrary physical memory. This could be leveraged by a local attacker to elevate privileges.",GIGABYTE,Multiple Products
CVE-2018-19320,7.8,0.21267,0.95288,"The GDrv low-level driver in GIGABYTE App Center, AORUS Graphics Engine, XTREME Gaming Engine, and OC GURU II exposes ring0 memcpy-like functionality that could allow a local attacker to take complete control of the affected system.",GIGABYTE,Multiple Products
CVE-2022-41352,9.8,0.79129,0.98982,Synacor Zimbra Collaboration Suite (ZCS) allows an attacker to upload arbitrary files using cpio package to gain incorrect access to any other user accounts.,Synacor,Zimbra Collaboration Suite (ZCS)
CVE-2021-3493,7.8,0.68961,0.98512,"The overlayfs stacking file system in Linux kernel does not properly validate the application of file capabilities against user namespaces, which could lead to privilege escalation.",Linux,Kernel
CVE-2022-40684,9.8,0.94427,0.99979,"Fortinet FortiOS, FortiProxy, and FortiSwitchManager contain an authentication bypass vulnerability that could allow an unauthenticated attacker to perform operations on the administrative interface via specially crafted HTTP or HTTPS requests.",Fortinet,Multiple Products
CVE-2022-41033,7.8,0.00234,0.46269,Microsoft Windows COM+ Event System Service contains an unspecified vulnerability that allows for privilege escalation.,Microsoft,Windows COM+ Event System Service
CVE-2022-41082,8.0,0.92262,0.99692,"Microsoft Exchange Server contains an unspecified vulnerability that allows for authenticated remote code execution. Dubbed ""ProxyNotShell,"" this vulnerability is chainable with CVE-2022-41040 which allows for the remote code execution.",Microsoft,Exchange Server
CVE-2022-41040,,0.94229,0.99912,"Microsoft Exchange Server allows for server-side request forgery. Dubbed ""ProxyNotShell,"" this vulnerability is chainable with CVE-2022-41082 which allows for remote code execution.",Microsoft,Exchange Server
CVE-2022-36804,8.8,0.94429,0.9998,"Multiple API endpoints of Atlassian Bitbucket Server and Data Center contain a command injection vulnerability where an attacker with access to a public Bitbucket repository, or with read permissions to a private one, can execute code by sending a malicious HTTP request.",Atlassian,Bitbucket Server and Data Center
CVE-2022-3236,9.8,0.9277,0.99738,A code injection vulnerability in the User Portal and Webadmin of Sophos Firewall allows for remote code execution.,Sophos,Firewall
CVE-2022-35405,9.8,0.943,0.99929,"Zoho ManageEngine PAM360, Password Manager Pro, and Access Manager Plus contain an unspecified vulnerability that allows for remote code execution.",Zoho,ManageEngine
CVE-2022-40139,7.2,0.14405,0.9401,Trend Micro Apex One and Apex One as a Service contain an improper validation of rollback mechanism components that could lead to remote code execution.,Trend Micro,Apex One and Apex One as a Service
CVE-2022-37969,7.8,0.05221,0.89367,Microsoft Windows Common Log File System (CLFS) driver contains an unspecified vulnerability that allows for privilege escalation.,Microsoft,Windows
CVE-2022-32917,7.8,0.00091,0.27274,"Apple kernel, which is included in iOS, iPadOS, and macOS, contains an unspecified vulnerability where an application may be able to execute code with kernel privileges.",Apple,"iOS, iPadOS, and macOS"
CVE-2022-3075,9.6,0.01332,0.78851,"Google Chromium Mojo contains an insufficient data validation vulnerability that allows a remote attacker, who has compromised the renderer process, to potentially perform a sandbox escape via a crafted HTML page. This vulnerability could affect multiple web browsers that utilize Chromium, including, but not limited to, Google Chrome, Microsoft Edge, and Opera.",Google,Chromium Mojo
CVE-2022-27593,9.1,0.94136,0.99896,Certain QNAP NAS running Photo Station with internet exposure contain an externally controlled reference to a resource vulnerability which can allow an attacker to modify system files. This vulnerability was observed being utilized in a Deadbolt ransomware campaign.,QNAP,Photo Station
CVE-2022-26258,9.8,0.90215,0.99545,D-Link DIR-820L contains an unspecified vulnerability in Device Name parameter in /lan.asp which allows for remote code execution.,D-Link,DIR-820L
CVE-2020-9934,5.5,0.01534,0.80291,"Apple iOS, iPadOS, and macOS contain an unspecified vulnerability involving input validation which can allow a local attacker to view sensitive user information.",Apple,"iOS, iPadOS, and macOS"
CVE-2018-7445,9.8,0.8603,0.99322,"In MikroTik RouterOS, a stack-based buffer overflow occurs when processing NetBIOS session request messages. Remote attackers with access to the service can exploit this vulnerability and gain code execution on the system.",MikroTik,RouterOS
CVE-2018-6530,9.8,0.94294,0.99927,Multiple D-Link routers contain an unspecified vulnerability that allows for execution of OS commands.,D-Link,Multiple Routers
CVE-2018-2628,9.8,0.94422,0.99976,Oracle WebLogic Server contains an unspecified vulnerability which can allow an unauthenticated attacker with T3 network access to compromise the server.,Oracle,WebLogic Server
CVE-2018-13374,4.3,0.04303,0.88209,Fortinet FortiOS and FortiADC contain an improper access control vulnerability that allows attackers to obtain the LDAP server login credentials configured in FortiGate by pointing a LDAP server connectivity test request to a rogue LDAP server.,Fortinet,FortiOS and FortiADC
CVE-2022-26352,9.8,0.94264,0.99922,"dotCMS ContentResource API contains an unrestricted upload of file with a dangerous type vulnerability that allows for directory traversal, in which the file is saved outside of the intended storage location. Exploitation allows for remote code execution.",dotCMS,dotCMS
CVE-2022-24706,9.8,0.94412,0.99971,Apache CouchDB contains an insecure default initialization of resource vulnerability which can allow an attacker to escalate to administrative privileges.,Apache,CouchDB
CVE-2022-24112,9.8,0.9434,0.99942,Apache APISIX contains an authentication bypass vulnerability that allows for remote code execution.,Apache,APISIX
CVE-2022-22963,9.8,0.94474,0.99995,"When using routing functionality in VMware Tanzu's Spring Cloud Function, it is possible for a user to provide a specially crafted SpEL as a routing-expression that may result in remote code execution and access to local resources.",VMware Tanzu,Spring Cloud
CVE-2022-2294,8.8,0.02177,0.83398,"WebRTC, an open-source project providing web browsers with real-time communication, contains a heap buffer overflow vulnerability that allows an attacker to perform shellcode execution. This vulnerability impacts web browsers using WebRTC including but not limited to Google Chrome.",WebRTC,WebRTC
CVE-2021-39226,7.3,0.9435,0.99947,"Grafana contains an authentication bypass vulnerability that allows authenticated and unauthenticated users to view and delete all snapshot data, potentially resulting in complete snapshot data loss.",Grafana Labs,Grafana
CVE-2021-38406,7.8,0.82169,0.99147,Delta Electronics DOPSoft 2 lacks proper validation of user-supplied data when parsing specific project files (improper input validation) resulting in an out-of-bounds write that allows for code execution.,Delta Electronics,DOPSoft 2
CVE-2021-31010,7.5,0.01359,0.79069,"In affected versions of Apple iOS, macOS, and watchOS, a sandboxed process may be able to circumvent sandbox restrictions.",Apple,"iOS, macOS, watchOS"
CVE-2020-36193,7.5,0.81263,0.99095,PEAR Archive_Tar Tar.php allows write operations with directory traversal due to inadequate checking of symbolic links. PEAR stands for PHP Extension and Application Repository and it is an open-source framework and distribution system for reusable PHP components with known usage in third-party products such as Drupal Core and Red Hat Linux.,PEAR,Archive_Tar
CVE-2020-28949,7.8,0.93057,0.99769,PEAR Archive_Tar allows an unserialization attack because phar: is blocked but PHAR: is not blocked. PEAR stands for PHP Extension and Application Repository and it is an open-source framework and distribution system for reusable PHP components with known usage in third-party products such as Drupal Core and Red Hat Linux.,PEAR,Archive_Tar
CVE-2022-0028,8.6,0.05011,0.89104,A Palo Alto Networks PAN-OS URL filtering policy misconfiguration could allow a network-based attacker to conduct reflected and amplified TCP denial-of-service (RDoS) attacks.,Palo Alto Networks,PAN-OS
CVE-2022-22536,10.0,0.93922,0.99863,"SAP NetWeaver Application Server ABAP, SAP NetWeaver Application Server Java, ABAP Platform, SAP Content Server and SAP Web Dispatcher allow HTTP request smuggling. An unauthenticated attacker can prepend a victim's request with arbitrary data, allowing for function execution impersonating the victim or poisoning intermediary Web caches.",SAP,Multiple Products
CVE-2022-32894,7.8,0.00472,0.63371,Apple iOS and macOS contain an out-of-bounds write vulnerability that could allow an application to execute code with kernel privileges.,Apple,iOS and macOS
CVE-2022-32893,8.8,0.00101,0.29131,Apple iOS and macOS contain an out-of-bounds write vulnerability that could allow for remote code execution when processing malicious crafted web content.,Apple,iOS and macOS
CVE-2022-2856,6.5,0.02364,0.84017,"Google Chromium Intents contains an insufficient validation of untrusted input vulnerability that allows a remote attacker to browse to a malicious website via a crafted HTML page. This vulnerability could affect multiple web browsers that utilize Chromium, including, but not limited to, Google Chrome, Microsoft Edge, and Opera.",Google,Chromium Intents
CVE-2022-26923,,0.91352,0.9962,"An authenticated user could manipulate attributes on computer accounts they own or manage, and acquire a certificate from Active Directory Certificate Services that would allow for privilege escalation to SYSTEM.",Microsoft,Active Directory
CVE-2022-21971,,0.83733,0.99217,Microsoft Windows Runtime contains an unspecified vulnerability that allows for remote code execution.,Microsoft,Windows
CVE-2022-27925,7.2,0.94306,0.99931,"Synacor Zimbra Collaboration Suite (ZCS) contains flaw in the mboximport functionality, allowing an authenticated attacker to upload arbitrary files to perform remote code execution. This vulnerability was chained with CVE-2022-37042 which allows for unauthenticated remote code execution.",Synacor,Zimbra Collaboration Suite (ZCS)
CVE-2022-37042,9.8,0.94274,0.99923,Synacor Zimbra Collaboration Suite (ZCS) contains an authentication bypass vulnerability in MailboxImportServlet. This vulnerability was chained with CVE-2022-27925 which allows for unauthenticated remote code execution.,Synacor,Zimbra Collaboration Suite (ZCS)
CVE-2022-34713,7.8,0.08936,0.92085,A remote code execution vulnerability exists when Microsoft Windows MSDT is called using the URL protocol from a calling application.,Microsoft,Windows
CVE-2022-30333,7.5,0.90688,0.99575,"RARLAB UnRAR on Linux and UNIX contains a directory traversal vulnerability, allowing an attacker to write to files during an extract (unpack) operation.",RARLAB,UnRAR
CVE-2022-27924,7.5,0.68853,0.98506,Synacor Zimbra Collaboration Suite (ZCS) allows an attacker to inject memcache commands into a targeted instance which causes an overwrite of arbitrary cached entries.,Synacor,Zimbra Collaboration Suite (ZCS)
CVE-2022-26138,9.8,0.94258,0.99919,"Atlassian Questions For Confluence App has hard-coded credentials, exposing the username and password in plaintext. A remote unauthenticated attacker can use these credentials to log into Confluence and access all content accessible to users in the confluence-users group.",Atlassian,Confluence
CVE-2022-22047,,0.00751,0.7185,Microsoft Windows CSRSS contains an unspecified vulnerability that allows for privilege escalation to SYSTEM privileges.,Microsoft,Windows
CVE-2022-26925,5.9,0.50643,0.97665,Microsoft Windows Local Security Authority (LSA) contains a spoofing vulnerability where an attacker can coerce the domain controller to authenticate to the attacker using NTLM.,Microsoft,Windows
CVE-2022-29499,9.8,0.89829,0.99522,The Service Appliance component in Mitel MiVoice Connect allows remote code execution due to incorrect data validation.,Mitel,MiVoice Connect
CVE-2021-30533,6.5,0.06193,0.903,"Google Chromium PopupBlocker contains an insufficient policy enforcement vulnerability that allows a remote attacker to bypass navigation restrictions via a crafted iframe. This vulnerability could affect multiple web browsers that utilize Chromium, including, but not limited to, Google Chrome, Microsoft Edge, and Opera.",Google,Chromium PopupBlocker
CVE-2021-4034,7.8,0.88729,0.99459,The Red Hat polkit pkexec utility contains an out-of-bounds read and write vulnerability that allows for privilege escalation with administrative rights.,Red Hat,Polkit
CVE-2021-30983,7.8,0.00603,0.68271,Apple iOS and iPadOS contain a buffer overflow vulnerability that could allow an application to execute code with kernel privileges.,Apple,iOS and iPadOS
CVE-2020-3837,7.8,0.05969,0.90113,"Apple iOS, iPadOS, macOS, tvOS, and watchOS contain a memory corruption vulnerability that could allow an application to execute code with kernel privileges.",Apple,Multiple Products
CVE-2020-9907,7.8,0.01964,0.8247,"Apple iOS, iPadOS, and tvOS contain a memory corruption vulnerability that could allow an application to execute code with kernel privileges.",Apple,Multiple Products
CVE-2019-8605,7.8,0.1107,0.93044,"A use-after-free vulnerability in Apple iOS, macOS, tvOS, and watchOS could allow a malicious application to execute code with system privileges.",Apple,Multiple Products
CVE-2018-4344,7.8,0.00515,0.65334,"Apple iOS, macOS, tvOS, and watchOS contain a memory corruption vulnerability which can allow for code execution.",Apple,Multiple Products
CVE-2022-30190,,0.93056,0.99769,A remote code execution vulnerability exists when MSDT is called using the URL protocol from a calling application such as Word. An attacker who successfully exploits this vulnerability can run code with the privileges of the calling application.,Microsoft,Windows
CVE-2021-38163,8.8,0.87734,0.9941,SAP NetWeaver contains a vulnerability that allows unrestricted file upload.,SAP,NetWeaver
CVE-2019-7195,9.8,0.88944,0.99474,QNAP devices running Photo Station contain an external control of file name or path vulnerability allowing remote attackers to access or modify system files.,QNAP,Photo Station
CVE-2019-7194,9.8,0.88558,0.9945,QNAP devices running Photo Station contain an external control of file name or path vulnerability allowing remote attackers to access or modify system files.,QNAP,Photo Station
CVE-2019-7193,9.8,0.61596,0.98192,QNAP QTS contains an improper input validation vulnerability allowing remote attackers to inject code on the system.,QNAP,QTS
CVE-2019-7192,9.8,0.94298,0.99928,QNAP NAS devices running Photo Station contain an improper access control vulnerability allowing remote attackers to gain unauthorized access to the system.,QNAP,Photo Station
CVE-2019-5825,6.5,0.72787,0.98674,"Google Chromium V8 Engine contains an out-of-bounds write vulnerability that allows a remote attacker to potentially exploit heap corruption via a crafted HTML page. This vulnerability could affect multiple web browsers that utilize Chromium, including, but not limited to, Google Chrome, Microsoft Edge, and Opera.",Google,Chromium V8
CVE-2019-15271,8.8,0.13994,0.93914,A deserialization of untrusted data vulnerability in the web-based management interface of certain Cisco Small Business RV Series Routers could allow an attacker to execute code with root privileges.,Cisco,RV Series Routers
CVE-2018-6065,8.8,0.88862,0.99469,"Google Chromium V8 Engine contains an integer overflow vulnerability that allows a remote attacker to potentially exploit heap corruption via a crafted HTML page. This vulnerability could affect multiple web browsers that utilize Chromium, including, but not limited to, Google Chrome, Microsoft Edge, and Opera.",Google,Chromium V8
CVE-2018-4990,8.8,0.70558,0.98576,Adobe Acrobat and Reader have a double free vulnerability that could lead to remote code execution.,Adobe,Acrobat and Reader
CVE-2018-17480,8.8,0.39964,0.971,"Google Chromium V8 Engine contains out-of-bounds write vulnerability that allows a remote attacker to execute code inside a sandbox via a crafted HTML page. This vulnerability could affect multiple web browsers that utilize Chromium, including, but not limited to, Google Chrome, Microsoft Edge, and Opera.",Google,Chromium V8
