CVE,CVSS3,EPSS,Description
CVE-2014-9163,,0.04095,Stack-based buffer overflow in Adobe Flash Player allows attackers to execute code remotely.
CVE-2022-22954,9.8,0.97526,VMware Workspace ONE Access and Identity Manager allow for remote code execution due to server-side template injection.
CVE-2022-22960,7.8,0.00115,"VMware Workspace ONE Access, Identity Manager and vRealize Automation contain a privilege escalation vulnerability due to improper permissions in support scripts."
CVE-2022-1364,8.8,0.01544,Google Chromium V8 engine contains a type confusion vulnerability.
CVE-2019-3929,9.8,0.97438,"Multiple Crestron products are vulnerable to command injection via the file_transfer.cgi HTTP endpoint. A remote, unauthenticated attacker can use this vulnerability to execute operating system commands as root."
CVE-2019-16057,9.8,0.97548,The login_mgr.cgi script in D-Link DNS-320 is vulnerable to remote code execution.
CVE-2018-7841,9.8,0.02076,A SQL Injection vulnerability exists in U.motion Builder software which could cause unwanted code execution when an improper set of characters is entered.
CVE-2016-4523,7.5,0.24332,The WAP interface in Trihedral VTScada (formerly VTS) allows remote attackers to cause a denial-of-service.
CVE-2014-0780,,0.96197,"InduSoft Web Studio NTWebServer contains a directory traversal vulnerability which allows remote attackers to read administrative passwords in APP files, allowing for remote code execution."
CVE-2010-5330,9.8,0.02343,Certain Ubiquiti devices contain a command injection vulnerability via a GET request to stainfo.cgi.
CVE-2007-3010,,0.97211,masterCGI in the Unified Maintenance Tool in Alcatel OmniPCX Enterprise Communication Server allows remote attackers to execute arbitrary commands.
CVE-2018-6882,6.1,0.0106,Zimbra Collaboration Suite (ZCS) contains a cross-site scripting vulnerability that might allow remote attackers to inject arbitrary web script or HTML.
CVE-2019-3568,9.8,0.03528,A buffer overflow vulnerability in WhatsApp VOIP stack allowed remote code execution via specially crafted series of RTCP packets sent to a target phone number.
CVE-2022-22718,7.8,0.00183,Microsoft Windows Print Spooler contains an unspecified vulnerability which allow for privilege escalation.
CVE-2022-29464,9.8,0.97476,"Multiple WSO2 products allow for unrestricted file upload, resulting in remote code execution."
CVE-2022-26904,7.0,0.00264,Microsoft Windows User Profile Service contains an unspecified vulnerability that allows for privilege escalation.
CVE-2022-21919,7.0,0.002,Microsoft Windows User Profile Service contains an unspecified vulnerability that allows for privilege escalation.
CVE-2022-0847,7.8,0.19014,"Linux kernel contains an improper initialization vulnerability where an unprivileged local user could escalate their privileges on the system. This vulnerability has the moniker of ""Dirty Pipe."""
CVE-2021-41357,7.8,0.00729,Microsoft Win32k contains an unspecified vulnerability that allows for privilege escalation.
CVE-2021-40450,7.8,0.00729,Microsoft Win32k contains an unspecified vulnerability that allows for privilege escalation.
CVE-2019-1003029,9.9,0.00849,"Jenkins Script Security Plugin contains a protection mechanism failure, allowing an attacker to bypass the sandbox."
CVE-2021-1789,8.8,0.00483,"A type confusion issue affecting multiple Apple products allows processing of maliciously crafted web content, leading to arbitrary code execution."
CVE-2019-8506,8.8,0.0809,"A type confusion issue affecting multiple Apple products allows processing of maliciously crafted web content, leading to arbitrary code execution."
CVE-2014-4113,,0.02281,Microsoft Win32k contains an unspecified vulnerability that allows for privilege escalation.
CVE-2014-0322,,0.97459,Use-after-free vulnerability in Microsoft Internet Explorer allows remote attackers to execute code.
CVE-2014-0160,7.5,0.97588,"The TLS and DTLS implementations in OpenSSL do not properly handle Heartbeat Extension packets, which allows remote attackers to obtain sensitive information."
CVE-2022-1388,9.8,0.9748,"F5 BIG-IP contains a missing authentication in critical function vulnerability which can allow for remote code execution, creation or deletion of files, or disabling services."
CVE-2022-30525,9.8,0.97528,A command injection vulnerability in the CGI program of some Zyxel firewall versions could allow an attacker to modify specific files and then execute some OS commands on a vulnerable device.
CVE-2022-22947,10.0,0.97534,"Spring Cloud Gateway applications are vulnerable to a code injection attack when the Gateway Actuator endpoint is enabled, exposed and unsecured."
CVE-2022-20821,6.5,0.00431,Cisco IOS XR software health check opens TCP port 6379 by default on activation. An attacker can connect to the Redis instance on the open port and allow access to the Redis instance that is running within the NOSi container.
CVE-2021-1048,7.8,0.00064,Android kernel contains a use-after-free vulnerability that allows for privilege escalation.
CVE-2021-0920,6.4,0.00064,"Android kernel contains a race condition, which allows for a use-after-free vulnerability. Exploitation can allow for privilege escalation."
CVE-2021-30883,7.8,0.00144,"Apple iOS, macOS, watchOS, and tvOS contain a memory corruption vulnerability that could allow for remote code execution."
CVE-2020-1027,7.8,0.00058,An elevation of privilege vulnerability exists in the way that the Windows Kernel handles objects in memory. An attacker who successfully exploited the vulnerability could execute code with elevated permissions.
CVE-2020-0638,7.8,0.00069,Microsoft Update Notification Manager contains an unspecified vulnerability that allows for privilege escalation.
CVE-2019-7286,7.8,0.00315,"Apple iOS, macOS, watchOS, and tvOS contain a memory corruption vulnerability that could allow for privilege escalation."
CVE-2019-7287,7.8,0.00125,Apple iOS contains a memory corruption vulnerability which could allow an attacker to perform remote code execution.
CVE-2019-0676,6.5,0.01989,An information disclosure vulnerability exists when Internet Explorer improperly handles objects in memory. An attacker who successfully exploited this vulnerability could test for the presence of files on disk.
CVE-2019-5786,6.5,0.97391,Google Chrome contains a heap use-after-free vulnerability which allows an attacker to potentially perform out of bounds memory access.
CVE-2019-0703,6.5,0.00207,"An information disclosure vulnerability exists in the way that the Windows SMB Server handles certain requests, which could lead to information disclosure from the server."
CVE-2019-0880,7.8,0.00042,A local elevation of privilege vulnerability exists in how splwow64.exe handles certain calls. An attacker who successfully exploited the vulnerability could elevate privileges on an affected system from low-integrity to medium-integrity.
CVE-2019-13720,8.8,0.97372,Use-after-free in WebAudio in Google Chrome allows a remote attacker to potentially exploit heap corruption.
CVE-2019-11707,8.8,0.78548,"Mozilla Firefox and Thunderbird contain a type confusion vulnerability that can occur when manipulating JavaScript objects due to issues in Array.pop, allowing for an exploitable crash."
CVE-2019-11708,10.0,0.00822,Mozilla Firefox and Thunderbird contain a sandbox escape vulnerability that could result in remote code execution.
CVE-2019-8720,8.8,0.00562,WebKitGTK contains a memory corruption vulnerability which can allow an attacker to perform remote code execution.
CVE-2019-18426,8.2,0.00936,A vulnerability in WhatsApp Desktop when paired with WhatsApp for iPhone allows cross-site scripting and local file reading.
CVE-2019-1385,7.8,0.00646,"A privilege escalation vulnerability exists when the Windows AppX Deployment Extensions improperly performs privilege management, resulting in access to system files."
CVE-2019-1130,7.8,0.92134,A privilege escalation vulnerability exists when Windows AppX Deployment Service (AppXSVC) improperly handles hard links.
CVE-2018-5002,9.8,0.02241,Adobe Flash Player have a stack-based buffer overflow vulnerability that could lead to remote code execution.
CVE-2018-8589,7.8,0.00089,A privilege escalation vulnerability exists when Windows improperly handles calls to Win32k.sys. An attacker who successfully exploited this vulnerability could run remote code in the security context of the local system.
CVE-2018-8611,7.8,0.00061,A privilege escalation vulnerability exists when the Windows kernel fails to properly handle objects in memory.
CVE-2018-19953,6.1,0.00371,A cross-site scripting vulnerability affecting QNAP NAS File Station could allow remote attackers to inject malicious code.
CVE-2018-19949,9.8,0.00672,A command injection vulnerability affecting QNAP NAS File Station could allow remote attackers to run commands.
CVE-2018-19943,5.4,0.00176,A cross-site scripting vulnerability affecting QNAP NAS File Station could allow remote attackers to inject malicious code.
CVE-2017-0147,5.9,0.97179,The SMBv1 server in Microsoft Windows allows remote attackers to obtain sensitive information from process memory via a crafted packet.
CVE-2017-0022,4.3,0.96943,"Microsoft XML Core Services (MSXML) improperly handles objects in memory, allowing attackers to test for files on disk via a crafted web site."
CVE-2017-0005,7.0,0.00102,The Graphics Device Interface (GDI) in Microsoft Windows allows local users to gain privileges via a crafted application.
CVE-2017-0149,7.5,0.108,Microsoft Internet Explorer allows remote attackers to execute code or cause a denial-of-service (memory corruption) via a crafted web site.
CVE-2017-0210,4.3,0.00379,"A privilege escalation vulnerability exists when Internet Explorer does not properly enforce cross-domain policies, which could allow an attacker to access information."
CVE-2017-8291,7.8,0.501,"Artifex Ghostscript allows -dSAFER bypass and remote command execution via .rsdparams type confusion with a ""/OutputFile."
CVE-2017-8543,9.8,0.31451,Microsoft Windows allows an attacker to take control of the affected system when Windows Search fails to handle objects in memory.
CVE-2017-18362,9.8,0.06991,ConnectWise ManagedITSync integration for Kaseya VSA is vulnerable to unauthenticated remote commands that allow full direct access to the Kaseya VSA database.
CVE-2016-0162,4.3,0.06384,An information disclosure vulnerability exists when Internet Explorer does not properly handle JavaScript. The vulnerability could allow an attacker to detect specific files on the user's computer.
CVE-2016-3351,3.1,0.13594,An information disclosure vulnerability exists in the way that certain functions in Internet Explorer and Edge handle objects in memory. The vulnerability could allow an attacker to detect specific files on the user's computer.
CVE-2016-4655,5.5,0.87656,The Apple iOS kernel allows attackers to obtain sensitive information from memory via a crafted application.
CVE-2016-4656,7.8,0.00456,A memory corruption vulnerability in Apple iOS kernel allows attackers to execute code in a privileged context or cause a denial-of-service via a crafted application.
CVE-2016-4657,8.8,0.87595,WebKit in Apple iOS contains a memory corruption vulnerability which allows attackers to execute remote code or cause a denial-of-service via a crafted web site.
CVE-2016-6366,8.8,0.9745,A buffer overflow vulnerability in the Simple Network Management Protocol (SNMP) code of Cisco ASA software could allow an attacker to cause a reload of the affected system or to remotely execute code.
CVE-2016-6367,7.8,0.97507,"A vulnerability in the command-line interface (CLI) parser of Cisco ASA software could allow an authenticated, local attacker to create a denial-of-service condition or potentially execute code."
CVE-2016-3298,5.3,0.95731,An information disclosure vulnerability exists when the Microsoft Internet Messaging API improperly handles objects in memory. An attacker who successfully exploited this vulnerability could allow the attacker to test for the presence of files on disk.
CVE-2019-3010,8.8,0.00394,Oracle Solaris component: XScreenSaver contains an unspecified vulnerability which allows for privilege escalation.
CVE-2016-3393,7.8,0.46295,A remote code execution vulnerability exists due to the way the Windows GDI component handles objects in the memory. An attacker who successfully exploits this vulnerability could take control of the affected system.
CVE-2016-7256,8.8,0.43365,A remote code execution vulnerability exists when the Windows font library improperly handles specially crafted embedded fonts. An attacker who successfully exploits this vulnerability could take control of the affected system.
CVE-2016-1010,8.8,0.95778,Integer overflow vulnerability in Adobe Flash Player and AIR allows attackers to execute code.
CVE-2016-0984,8.8,0.07694,Use-after-free vulnerability in Adobe Flash Player and Adobe AIR allows attackers to execute code.
CVE-2016-0034,8.8,0.78826,"Microsoft Silverlight mishandles negative offsets during decoding, which allows attackers to execute remote code or cause a denial-of-service."
CVE-2015-0310,,0.88446,"Adobe Flash Player does not properly restrict discovery of memory addresses, which allows attackers to bypass the address space layout randomization (ASLR) protection mechanism."
CVE-2015-0016,,0.26597,Directory traversal vulnerability in the TS WebProxy (TSWbPrxy) component in Microsoft Windows allows remote attackers to escalate privileges.
CVE-2015-0071,,0.5678,Microsoft Internet Explorer allows remote attackers to bypass the address space layout randomization (ASLR) protection mechanism via a crafted web site.
CVE-2015-2360,,0.00084,Win32k.sys in the kernel-mode drivers in Microsoft Windows allows local users to gain privileges or cause denial-of-service.
CVE-2015-2425,,0.96585,Microsoft Internet Explorer contains a memory corruption vulnerability that allows remote attackers to execute code or cause denial-of-service.
CVE-2015-1769,,0.00167,A privilege escalation vulnerability exists when the Windows Mount Manager component improperly processes symbolic links.
CVE-2015-4495,,0.966,Moxilla Firefox allows remote attackers to bypass the Same Origin Policy to read arbitrary files or gain privileges.
CVE-2015-8651,8.8,0.19596,Integer overflow in Adobe Flash Player allows attackers to execute code.
CVE-2015-6175,,0.00043,The kernel in Microsoft Windows contains a vulnerability that allows local users to gain privileges via a crafted application.
CVE-2015-1671,,0.23789,"A remote code execution vulnerability exists when components of Windows, .NET Framework, Office, Lync, and Silverlight fail to properly handle TrueType fonts."
CVE-2014-4148,,0.40853,A remote code execution vulnerability exists when the Windows kernel-mode driver improperly handles TrueType fonts.
CVE-2014-8439,,0.88421,Adobe Flash Player has a vulnerability in the way it handles a dereferenced memory pointer which could lead to code execution.
CVE-2014-4123,,0.00941,Microsoft Internet Explorer contains an unspecified vulnerability that allows remote attackers to gain privileges via a crafted web site.
CVE-2014-0546,,0.01263,"Adobe Acrobat and Reader on Windows allow attackers to bypass a sandbox protection mechanism, and consequently execute native code in a privileged context."
CVE-2014-2817,,0.01193,Microsoft Internet Explorer cotains an unspecified vulnerability that allows remote attackers to gain privileges via a crafted web site.
CVE-2014-4077,,0.00739,Microsoft Input Method Editor (IME) Japanese is a keyboard with Japanese characters that can be enabled on Windows systems as it is included by default (with the default set as disabled). IME Japanese contains an unspecified vulnerability when IMJPDCT.EXE (IME for Japanese) is installed which allows attackers to bypass a sandbox and perform privilege escalation.
CVE-2014-3153,,0.00052,"The futex_requeue function in kernel/futex.c in Linux kernel does not ensure that calls have two different futex addresses, which allows local users to gain privileges."
CVE-2013-7331,,0.49379,An information disclosure vulnerability exists in Internet Explorer which allows resources loaded into memory to be queried. This vulnerability could allow an attacker to detect anti-malware applications.
CVE-2013-3993,,0.00618,"Certain APIs within BigInsights can take invalid input that might allow attackers unauthorized access to read, write, modify, or delete data."
CVE-2013-3896,,0.14532,"Microsoft Silverlight does not properly validate pointers during access to Silverlight elements, which allows remote attackers to obtain sensitive information via a crafted Silverlight application."
CVE-2013-2423,,0.97512,Unspecified vulnerability in hotspot for Java Runtime Environment (JRE) allows remote attackers to affect integrity.
CVE-2013-0431,,0.97488,Unspecified vulnerability in the Java Runtime Environment (JRE) component in Oracle allows remote attackers to bypass the Java security sandbox.
CVE-2013-0422,,0.97435,A vulnerability in the way Java restricts the permissions of Java applets could allow an attacker to execute commands on a vulnerable system.
CVE-2013-0074,,0.96731,"Microsoft Silverlight does not properly validate pointers during HTML object rendering, which allows remote attackers to execute code via a crafted Silverlight application."
CVE-2012-1710,,0.95401,"Unspecified vulnerability in the Oracle WebCenter Forms Recognition component in Oracle Fusion Middleware allows remote attackers to affect confidentiality, integrity, and availability via unknown vectors related to Designer."
CVE-2010-1428,,0.00881,"Unauthenticated access to the JBoss Application Server Web Console (/web-console) is blocked by default. However, it was found that this block was incomplete, and only blocked GET and POST HTTP verbs. A remote attacker could use this flaw to gain access to sensitive information."
CVE-2010-0840,,0.939,"Unspecified vulnerability in the Java Runtime Environment (JRE) in Java SE component allows remote attackers to affect confidentiality, integrity, and availability via unknown vectors."
CVE-2010-0738,,0.97433,"The JMX-Console web application in JBossAs in Red Hat JBoss Enterprise Application Platform performs access control only for the GET and POST methods, which allows remote attackers to send requests to this application's GET handler by using a different method."
CVE-2022-26134,9.8,0.97533,Atlassian Confluence Server and Data Center contain a remote code execution vulnerability that allows for an unauthenticated attacker to perform remote code execution.
CVE-2022-31460,7.4,0.00461,Owl Labs Meeting Owl and Whiteboard Owl allow attackers to activate Tethering Mode with hard-coded hoothoot credentials via a certain c 150 value.
CVE-2019-7195,9.8,0.97032,QNAP devices running Photo Station contain an external control of file name or path vulnerability allowing remote attackers to access or modify system files.
CVE-2019-7194,9.8,0.97032,QNAP devices running Photo Station contain an external control of file name or path vulnerability allowing remote attackers to access or modify system files.
CVE-2019-7193,9.8,0.05988,QNAP QTS contains an improper input validation vulnerability allowing remote attackers to inject code on the system.
CVE-2019-7192,9.8,0.96645,QNAP NAS devices running Photo Station contain an improper access control vulnerability allowing remote attackers to gain unauthorized access to the system.
CVE-2019-5825,6.5,0.58829,Google Chromium V8 Engine contains an out-of-bounds write vulnerability which allows a remote attacker to potentially exploit heap corruption.
CVE-2019-15271,8.8,0.00217,A deserialization of untrusted data vulnerability in the web-based management interface of certain Cisco Small Business RV Series Routers could allow an attacker to execute code with root privileges.
CVE-2018-6065,8.8,0.97319,Google Chromium V8 Engine contains an integer overflow vulnerability which allows a remote attacker to potentially exploit heap corruption.
CVE-2018-4990,8.8,0.0669,Adobe Acrobat and Reader have a double free vulnerability that could lead to remote code execution.
CVE-2018-17480,8.8,0.02424,Google Chromium V8 Engine contains an out-of-bounds write vulnerability which allows a remote attacker to execute code inside a sandbox.
CVE-2018-17463,8.8,0.97474,Google Chromium V8 Engine contains an unspecified vulnerability which allows for remote code execution.
CVE-2017-6862,9.8,0.10557,Multiple NETGEAR devices contain a buffer overflow vulnerability that allows for authentication bypass and remote code execution.
CVE-2017-5070,8.8,0.97183,Google Chromium V8 Engine contains a type confusion vulnerability which allows a remote attacker to execute code inside a sandbox.
CVE-2017-5030,8.8,0.56605,Google Chromium V8 Engine contains a memory corruption vulnerability which allows a remote attacker to execute code.
CVE-2016-5198,8.8,0.02838,Google Chromium V8 Engine contains an out-of-bounds memory vulnerability.
CVE-2016-1646,8.8,0.0121,Google Chromium V8 contains an out-of-bounds read vulnerability.
CVE-2013-1331,,0.96847,Microsoft Office contains a buffer overflow vulnerability which allows remote attackers to execute code via crafted PNG data in an Office document.
CVE-2012-5054,,0.3734,Adobe Flash Player contains an integer overflow vulnerability which allows remote attackers to execute code via malformed arguments.
CVE-2012-4969,,0.85595,Microsoft Internet Explorer contains a use-after-free vulnerability which allows remote attackers to execute code via a crafted web site.
CVE-2012-1889,,0.97467,Microsoft XML Core Services contains a memory corruption vulnerability which could allow for remote code execution.
CVE-2012-0767,,0.00278,Adobe Flash Player contains a XSS vulnerability which allows remote attackers to inject web script or HTML.
CVE-2012-0754,,0.97327,Adobe Flash Player contains a memory corruption vulnerability which allows remote attackers to execute code or cause denial-of-service.
CVE-2012-0151,,0.95555,"The Authenticode Signature Verification function in Microsoft Windows (WinVerifyTrust) does not properly validate the digest of a signed portable executable (PE) file, which allows user-assisted remote attackers to execute code."
CVE-2011-2462,,0.97031,The Universal 3D (U3D) component in Adobe Acrobat and Reader contains a memory corruption vulnerability which could allow remote attackers to execute code or cause denial-of-service.
CVE-2011-0609,,0.97312,Adobe Flash Player contains an unspecified vulnerability which allows remote attackers to execute code or cause denial-of-service.
CVE-2010-2883,,0.72593,Adobe Acrobat and Reader contain a stack-based buffer overflow vulnerability which allows remote attackers to execute code or cause denial-of-service.
CVE-2010-2572,,0.91375,Microsoft PowerPoint contains a buffer overflow vulnerability that alllows for remote code execution.
CVE-2010-1297,,0.35536,Adobe Flash Player contains a memory corruption vulnerability that allows remote attackers to execute code or cause denial-of-service.
CVE-2009-4324,,0.9667,Use-after-free vulnerability in Adobe Acrobat and Reader allows remote attackers to execute code via a crafted PDF file.
CVE-2009-3953,,0.96988,Adobe Acrobat and Reader contains an array boundary issue in Universal 3D (U3D) support that could lead to remote code execution.
CVE-2009-1862,,0.29405,Adobe Acrobat and Reader and Adobe Flash Player allows remote attackers to execute code or cause denial-of-service.
CVE-2009-0563,,0.90311,Microsoft Office contains a buffer overflow vulnerability that allows remote attackers to execute code via a Word document with a crafted tag containing an invalid length field.
CVE-2009-0557,,0.97093,Microsoft Office contains an object record corruption vulnerability which allows remote attackers to execute code via a crafted Excel file with a malformed record object.
CVE-2008-0655,,0.95304,Adobe Acrobat and Reader contains an unespecified vulnerability described as a design flaw which could allow a specially crafted file to be printed silently an arbitrary number of times.
CVE-2007-5659,,0.97231,Adobe Acrobat and Reader contain a buffer overflow vulnerability which allows remote attackers to execute code via a PDF file with long arguments to unspecified JavaScript methods.
CVE-2006-2492,,0.94327,Microsoft Word and Microsoft Works Suites contain a malformed object pointer which allows attackers to execute code.
CVE-2021-38163,8.8,0.96601,SAP NetWeaver contains a vulnerability that allows unrestricted file upload.
CVE-2016-2386,9.8,0.38649,SQL injection vulnerability in the UDDI server in SAP NetWeaver J2EE Engine 7.40 allows remote attackers to execute arbitrary SQL commands via unspecified vectors.
CVE-2016-2388,5.3,0.0129,The Universal Worklist Configuration in SAP NetWeaver AS JAVA 7.4 allows remote attackers to obtain sensitive user information via a crafted HTTP request.
CVE-2022-30190,7.8,0.97251,A remote code execution vulnerability exists when MSDT is called using the URL protocol from a calling application such as Word. An attacker who successfully exploits this vulnerability can run code with the privileges of the calling application.
CVE-2022-29499,9.8,0.03512,The Service Appliance component in Mitel MiVoice Connect allows remote code execution due to incorrect data validation.
CVE-2021-30533,6.5,0.00546,Insufficient policy enforcement in the PopupBlocker for Chromium allows an attacker to remotely bypass security mechanisms. This vulnerability impacts web browsers using Chromium such as Chrome and Edge.
CVE-2021-4034,7.8,0.00046,The Red Hat polkit pkexec utility contains an out-of-bounds read and write vulnerability which allows for privilege escalation with administrative rights.
CVE-2021-30983,7.8,0.00088,Apple iOS and iPadOS contain a buffer overflow vulnerability that could allow an application to execute code with kernel privileges.
