CVE,CVSS3,EPSS,EPSS Percentile,Description,Vendor,Product
CVE-2021-28550,8.8,0.3525,0.96787,Adobe Acrobat and Reader contains a use-after-free vulnerability that could allow an unauthenticated attacker to achieve code execution in the context of the current user.,Adobe,Acrobat and Reader
CVE-2018-4939,9.8,0.85528,0.99301,Adobe ColdFusion contains a deserialization of untrusted data vulnerability that could allow for code execution.,Adobe,ColdFusion
CVE-2018-15961,9.8,0.94351,0.99947,Adobe ColdFusion contains an unrestricted file upload vulnerability that could allow for code execution.,Adobe,ColdFusion
CVE-2018-4878,9.8,0.9338,0.998,Adobe Flash Player contains a use-after-free vulnerability that could allow for code execution.,Adobe,Flash Player
CVE-2020-5735,8.8,0.5051,0.97659,"Amcrest cameras and NVR contain a stack-based buffer overflow vulnerability through port 37777 that allows an unauthenticated, remote attacker to crash the device and possibly execute code.",Amcrest,Cameras and Network Video Recorder (NVR)
CVE-2019-2215,7.8,0.48159,0.97549,"Android Kernel contains a use-after-free vulnerability in binder.c that allows for privilege escalation from an application to the Linux Kernel. This vulnerability was observed chained with CVE-2020-0041 and CVE-2020-0069 under exploit chain ""AbstractEmu.""",Android,Android Kernel
CVE-2020-0041,7.8,0.20754,0.95215,"Android Kernel binder_transaction of binder.c contains an out-of-bounds write vulnerability due to an incorrect bounds check that could allow for local privilege escalation. This vulnerability was observed chained with CVE-2019-2215 and CVE-2020-0069 under exploit chain ""AbstractEmu.""",Android,Android Kernel
CVE-2020-0069,7.8,0.01722,0.81347,"Multiple MediaTek chipsets contain an insufficient input validation vulnerability and have missing SELinux restrictions in the Command Queue drivers ioctl handlers. This causes an out-of-bounds write leading to privilege escalation. This vulnerability was observed chained with CVE-2019-2215 and CVE-2020-0041 under exploit chain ""AbstractEmu.""",MediaTek,Multiple Chipsets
CVE-2021-42013,9.8,0.94428,0.9998,Apache HTTP Server contains a path traversal vulnerability that allows an attacker to perform remote code execution if files outside directories configured by Alias-like directives are not under default require all denied or if CGI scripts are enabled. This CVE ID resolves an incomplete patch for CVE-2021-41773.,Apache,HTTP Server
CVE-2021-41773,7.5,0.94398,0.99968,"Apache HTTP Server contains a path traversal vulnerability that allows an attacker to perform remote code execution if files outside directories configured by Alias-like directives are not under default �require all denied� or if CGI scripts are enabled. The original patch issued under this CVE ID is insufficient, please review remediation information under CVE-2021-42013.",Apache,HTTP Server
CVE-2019-0211,7.8,0.83461,0.99205,"Apache HTTP Server, with MPM event, worker or prefork, code executing in less-privileged child processes or threads (including scripts executed by an in-process scripting interpreter) could execute code with the privileges of the parent process (usually root) by manipulating the scoreboard.",Apache,HTTP Server
CVE-2019-17558,7.5,0.94474,0.99996,The Apache Solr VelocityResponseWriter plug-in contains an unspecified vulnerability which can allow for remote code execution.,Apache,Solr
CVE-2020-17530,9.8,0.94395,0.99966,"Forced Object-Graph Navigation Language (OGNL) evaluation in Apache Struts, when evaluated on raw user input in tag attributes, can lead to remote code execution.",Apache,Struts
CVE-2018-11776,8.1,0.94429,0.99981,"Apache Struts contains a vulnerability that allows for remote code execution under two circumstances. One, where the alwaysSelectFullNamespace option is true and the value isn't set for a result defined in underlying configurations and in same time, its upper package configuration have no or wildcard namespace.  Or, using URL tag which doesn't have value and action set and in same time, its upper package configuration have no or wildcard namespace.",Apache,Struts
CVE-2021-30858,8.8,0.01026,0.76063,"Apple iOS, iPadOS, and macOS WebKit contain a use-after-free vulnerability that leads to code execution when processing maliciously crafted web content. This vulnerability could impact HTML parsers that use WebKit, including but not limited to Apple Safari and non-Apple products which rely on WebKit for HTML processing.",Apple,"iOS, iPadOS, and macOS"
CVE-2019-6223,7.5,0.00489,0.6424,Apple iOS and macOS Group FaceTime contains an unspecified vulnerability where the call initiator can cause the recipient's Apple device to answer unknowingly or without user interaction.,Apple,iOS and macOS
CVE-2021-30860,7.8,0.69382,0.98527,"Apple iOS, iPadOS, macOS, and watchOS CoreGraphics contain an integer overflow vulnerability which may allow code execution when processing a maliciously crafted PDF. The vulnerability is also known under the moniker of FORCEDENTRY.",Apple,Multiple Products
CVE-2020-27930,7.8,0.42973,0.97283,"Apple iOS, iPadOS, macOS, and watchOS FontParser contain a memory corruption vulnerability which may allow for code execution when processing maliciously crafted front.",Apple,Multiple Products
CVE-2021-30807,7.8,0.18136,0.94787,"Apple iOS, iPadOS, macOS, and watchOS IOMobileFrameBuffer contain a memory corruption vulnerability which may allow an application to execute code with kernel privileges.",Apple,Multiple Products
CVE-2020-27950,5.5,0.37741,0.96959,"Apple iOS, iPadOS, macOS, and watchOS contain a memory initialization vulnerability that may allow a malicious application to disclose kernel memory.",Apple,Multiple Products
CVE-2020-27932,7.8,0.01976,0.82519,"Apple iOS, iPadOS, macOS, and watchOS contain a type confusion vulnerability that may allow a malicious application to execute code with kernel privileges.",Apple,Multiple Products
CVE-2020-9818,8.8,0.00561,0.66972,"Apple iOS, iPadOS, and watchOS Mail contains an out-of-bounds write vulnerability which may allow memory modification or application termination when processing a maliciously crafted mail message.",Apple,"iOS, iPadOS, and watchOS"
CVE-2020-9819,4.3,0.00446,0.6225,"Apple iOS, iPadOS, and watchOS Mail contains a memory corruption vulnerability that may allow heap corruption when processing a maliciously crafted mail message.",Apple,"iOS, iPadOS, and watchOS"
CVE-2021-30762,8.8,0.00097,0.28279,"Apple iOS WebKit contains a use-after-free vulnerability that leads to code execution when processing maliciously crafted web content. This vulnerability could impact HTML parsers that use WebKit, including but not limited to Apple Safari and non-Apple products which rely on WebKit for HTML processing.",Apple,iOS
CVE-2021-1782,7.0,0.06773,0.90764,"Apple iOS, iPadOs, macOS, watchOS, and tvOS contain a race condition vulnerability that may allow a malicious application to elevate privileges.",Apple,Multiple Products
CVE-2021-1870,9.8,0.00547,0.66558,"Apple iOS, iPadOS, and macOS WebKit contain an unspecified logic vulnerability that allows a remote attacker to execute code. This vulnerability could impact HTML parsers that use WebKit, including but not limited to Apple Safari and non-Apple products which rely on WebKit for HTML processing.",Apple,"iOS, iPadOS, and macOS"
CVE-2021-1871,9.8,0.00997,0.75733,"Apple iOS, iPadOS, and macOS WebKit contain an unspecified logic vulnerability that allows a remote attacker to execute code. This vulnerability could impact HTML parsers that use WebKit, including but not limited to Apple Safari and non-Apple products which rely on WebKit for HTML processing.",Apple,"iOS, iPadOS, and macOS"
CVE-2021-1879,6.1,0.02049,0.82838,"Apple iOS, iPadOS, and watchOS WebKit contain an unspecified vulnerability that allows for universal cross-site scripting (XSS) when processing maliciously crafted web content. This vulnerability could impact HTML parsers that use WebKit, including but not limited to Apple Safari and non-Apple products which rely on WebKit for HTML processing.",Apple,"iOS, iPadOS, and watchOS"
CVE-2021-30661,8.8,0.00218,0.4455,"Apple iOS, iPadOS, macOS, tvOS, watchOS, and Safari WebKit Storage contain a use-after-free vulnerability that leads to code execution when processing maliciously crafted web content. This vulnerability could impact HTML parsers that use WebKit, including but not limited to Apple Safari and non-Apple products which rely on WebKit for HTML processing.",Apple,Multiple Products
CVE-2021-30666,8.8,0.00901,0.7441,"Apple iOS WebKit contains a buffer-overflow vulnerability that leads to code execution when processing maliciously crafted web content. This vulnerability could impact HTML parsers that use WebKit, including but not limited to Apple Safari and non-Apple products which rely on WebKit for HTML processing.",Apple,iOS
CVE-2021-30713,7.8,0.0012,0.32226,"Apple macOS Transparency, Consent, and Control (TCC) contains an unspecified permissions issue which may allow a malicious application to bypass privacy preferences.",Apple,macOS
CVE-2021-30657,5.5,0.75513,0.98806,Apple macOS contains an unspecified logic issue in System Preferences that may allow a malicious application to bypass Gatekeeper checks.,Apple,macOS
CVE-2021-30665,8.8,0.00562,0.67063,"Apple iOS, iPadOS, macOS, watchOS, and tvOS WebKit contain a memory corruption vulnerability that leads to code execution when processing maliciously crafted web content. This vulnerability could impact HTML parsers that use WebKit, including but not limited to Apple Safari and non-Apple products which rely on WebKit for HTML processing.",Apple,Multiple Products
CVE-2021-30663,8.8,0.00215,0.4427,"Apple iOS, iPadOS, macOS, tvOS, and Safari WebKit contain an integer overflow vulnerability that leads to code execution when processing maliciously crafted web content. This vulnerability could impact HTML parsers that use WebKit, including but not limited to Apple Safari and non-Apple products which rely on WebKit for HTML processing.",Apple,Multiple Products
CVE-2021-30761,8.8,0.00413,0.60441,"Apple iOS WebKit contains a memory corruption vulnerability that leads to code execution when processing maliciously crafted web content. This vulnerability could impact HTML parsers that use WebKit, including but not limited to Apple Safari and non-Apple products which rely on WebKit for HTML processing.",Apple,iOS
CVE-2021-30869,7.8,0.04229,0.88113,"Apple iOS, iPadOS, and macOS contain a type confusion vulnerability in the XNU which may allow a malicious application to execute code with kernel privileges.",Apple,"iOS, iPadOS, and macOS"
CVE-2020-9859,7.8,0.00369,0.57725,"Apple iOS, iPadOS, macOS, watchOS, and tvOS contain an unspecified vulnerability that may allow an application to execute code with kernel privileges.",Apple,Multiple Products
CVE-2021-20090,9.8,0.94369,0.99954,"Arcadyan Buffalo firmware contains a path traversal vulnerability that could allow unauthenticated, remote attackers to bypass authentication and access sensitive information. This vulnerability affects multiple routers across several different vendors.",Arcadyan,Buffalo Firmware
CVE-2021-27562,5.5,0.79194,0.98985,"Arm Trusted Firmware contains an out-of-bounds write vulnerability allowing the non-secure (NS) world to trigger a system halt, overwrite secure data, or print out secure data when calling secure functions under the non-secure processing environment (NSPE) handler mode. This vulnerability affects Yealink Device Management servers.",Arm,Trusted Firmware
CVE-2021-28664,8.8,0.00264,0.49637,"Arm Mali Graphics Processing Unit (GPU) kernel driver contains an unspecified vulnerability that may allow a non-privileged user to gain write access to read-only memory, gain root privilege, corrupt memory, and modify the memory of other processes.",Arm,Mali Graphics Processing Unit (GPU)
CVE-2021-28663,8.8,0.07289,0.91134,"Arm Mali Graphics Processing Unit (GPU) kernel driver contains a use-after-free vulnerability that may allow a non-privileged user to make improper operations on GPU memory to gain root privilege, and/or disclose information.",Arm,Mali Graphics Processing Unit (GPU)
CVE-2019-3398,8.8,0.93966,0.9987,"Atlassian Confluence Server and Data Center contain a path traversal vulnerability in the downloadallattachments resource that may allow a privileged, remote attacker to write files. Exploitation can lead to remote code execution.",Atlassian,Confluence Server and Data Center
CVE-2021-26084,9.8,0.94437,0.99985,Atlassian Confluence Server and Data Server contain an Object-Graph Navigation Language (OGNL) injection vulnerability that may allow an unauthenticated attacker to execute code.,Atlassian,Confluence Server and Data Center
CVE-2019-11580,9.8,0.94375,0.99956,Atlassian Crowd and Crowd Data Center contain a remote code execution vulnerability resulting from a pdkinstall development plugin being incorrectly enabled in release builds.,Atlassian,Crowd and Crowd Data Center
CVE-2019-3396,9.8,0.94486,0.99998,Atlassian Confluence Server and Data Center contain a server-side template injection vulnerability that may allow an attacker to achieve path traversal and remote code execution.,Atlassian,Confluence Server and Data Server
CVE-2021-42258,9.8,0.93901,0.99859,"BQE BillQuick Web Suite contains an SQL injection vulnerability when accessing the username parameter that may allow for unauthenticated, remote code execution.",BQE,BillQuick Web Suite
CVE-2020-3452,7.5,0.94452,0.9999,Cisco Adaptive Security Appliance (ASA) and Firepower Threat Defense (FTD) contain an improper input validation vulnerability when HTTP requests process URLs.  An attacker could exploit this vulnerability by sending a crafted HTTP request containing directory traversal character sequences to an affected device. A successful exploit could allow the attacker to view arbitrary files within the web services file system on the targeted device.,Cisco,Adaptive Security Appliance (ASA) and Firepower Threat Defense (FTD)
CVE-2020-3580,6.1,0.93247,0.9979,Cisco Adaptive Security Appliance (ASA) and Firepower Threat Defense (FTD) contain an insufficient input validation vulnerability for user-supplied input by the web services interface.  Successful exploitation could allow an attacker to perform cross-site scripting (XSS) in the context of the interface or access sensitive browser-based information.,Cisco,Adaptive Security Appliance (ASA) and Firepower Threat Defense (FTD)
CVE-2021-1497,9.8,0.94254,0.99918,Cisco HyperFlex HX Installer Virtual Machine contains an insufficient input validation vulnerability which could allow an attacker to execute commands on an affected device as the root user.,Cisco,HyperFlex HX
CVE-2021-1498,9.8,0.94059,0.99884,Cisco HyperFlex HX Installer Virtual Machine contains an insufficient input validation vulnerability which could allow an attacker to execute commands on an affected device as the tomcat8 user.,Cisco,HyperFlex HX
CVE-2018-0171,9.8,0.89101,0.9948,"Cisco IOS and IOS XE Software improperly validates packet data, allowing an unauthenticated, remote attacker to trigger a reload of an affected device, cause a denial-of-service (DoS) condition, or perform code execution on the affected device.",Cisco,IOS and IOS XE
CVE-2020-3118,8.8,0.00143,0.35746,"Cisco IOS XR improperly validates string input from certain fields in Cisco Discovery Protocol messages. Exploitation could allow an unauthenticated, adjacent attacker to execute code with administrative privileges or cause a reload on an affected device.",Cisco,IOS XR
CVE-2020-3566,8.6,0.18957,0.94939,"Cisco IOS XR Distance Vector Multicast Routing Protocol (DVMRP) incorrectly handles Internet Group Management Protocol (IGMP) packets. Exploitation could allow an unauthenticated, remote attacker to immediately crash the IGMP process or make it consume available memory and eventually crash.",Cisco,IOS XR
CVE-2020-3569,8.6,0.34267,0.96718,"Cisco IOS XR Distance Vector Multicast Routing Protocol (DVMRP) incorrectly handles Internet Group Management Protocol (IGMP) packets. Exploitation could allow an unauthenticated, remote attacker to immediately crash the IGMP process or make it consume available memory and eventually crash.",Cisco,IOS XR
CVE-2020-3161,9.8,0.82191,0.99148,Cisco IP Phones contain an improper input validation vulnerability for HTTP requests. Exploitation could allow an attacker to execute code remotely with root privileges or cause a denial-of-service (DoS) condition.,Cisco,Cisco IP Phones
CVE-2019-1653,7.5,0.94389,0.99963,Cisco Small Business RV320 and RV325 Dual Gigabit WAN VPN Routers contain improper access controls for URLs. Exploitation could allow an attacker to download the router configuration or detailed diagnostic information.,Cisco,Small Business RV320 and RV325 Routers
CVE-2018-0296,7.5,0.94436,0.99984,Cisco Adaptive Security Appliance (ASA) contains an improper input validation vulnerability with HTTP URLs. Exploitation could allow an attacker to cause a denial-of-service (DoS) condition or information disclosure.,Cisco,Adaptive Security Appliance (ASA)
CVE-2019-13608,7.5,0.41898,0.97214,Citrix StoreFront Server contains an XML External Entity (XXE) processing vulnerability that may allow an unauthenticated attacker to retrieve potentially sensitive information.,Citrix,StoreFront Server
CVE-2020-8193,6.5,0.94349,0.99946,"Citrix ADC, Citrix Gateway, and multiple Citrix SD-WAN WANOP appliance models contain an authorization bypass vulnerability that may allow unauthenticated access to certain URL endpoints. The attacker must have access to the NetScaler IP (NSIP) in order to perform exploitation.",Citrix,"Application Delivery Controller (ADC), Gateway, and SD-WAN WANOP Appliance"
CVE-2020-8195,6.5,0.85271,0.99289,"Citrix ADC, Citrix Gateway, and multiple Citrix SD-WAN WANOP appliance models contain an information disclosure vulnerability.",Citrix,"Application Delivery Controller (ADC), Gateway, and SD-WAN WANOP Appliance"
CVE-2020-8196,4.3,0.62974,0.98243,"Citrix ADC, Citrix Gateway, and multiple Citrix SD-WAN WANOP appliance models contain an information disclosure vulnerability.",Citrix,"Application Delivery Controller (ADC), Gateway, and SD-WAN WANOP Appliance"
CVE-2019-19781,9.8,0.94442,0.99987,"Citrix ADC, Citrix Gateway, and multiple Citrix SD-WAN WANOP appliance models contain an unspecified vulnerability that could allow an unauthenticated attacker to perform code execution.",Citrix,"Application Delivery Controller (ADC), Gateway, and SD-WAN WANOP Appliance"
CVE-2019-11634,9.8,0.59561,0.9809,Citrix Workspace Application and Receiver for Windows contains remote code execution vulnerability resulting from local drive access preferences not being enforced into the clients' local drives.,Citrix,Workspace Application and Receiver for Windows
CVE-2020-29557,9.8,0.9186,0.99662,D-Link DIR-825 R1 devices contain a buffer overflow vulnerability in the web interface that may allow for remote code execution.,D-Link,DIR-825 R1 Devices
CVE-2020-25506,9.8,0.93863,0.99855,D-Link DNS-320 device contains a command injection vulnerability in the sytem_mgr.cgi component that may allow for remote code execution.,D-Link,DNS-320 Device
CVE-2018-15811,7.5,0.75277,0.98797,DotNetNuke (DNN) contains an inadequate encryption strength vulnerability resulting from the use of a weak encryption algorithm to protect input parameters.,DotNetNuke (DNN),DotNetNuke (DNN)
CVE-2018-18325,7.5,0.75277,0.98797,DotNetNuke (DNN) contains an inadequate encryption strength vulnerability resulting from the use of a weak encryption algorithm to protect input parameters. This CVE ID resolves an incomplete patch for CVE-2018-15811.,DotNetNuke (DNN),DotNetNuke (DNN)
CVE-2019-15752,7.8,0.57879,0.98007,Docker Desktop Community Edition contains a vulnerability that may allow local users to escalate privileges by placing a trojan horse docker-credential-wincred.exe file in %PROGRAMDATA%\DockerDesktop\version-bin\.,Docker,Desktop Community Edition
CVE-2020-8515,9.8,0.94357,0.99949,"DrayTek Vigor3900, Vigor2960, and Vigor300B routers contain an unspecified vulnerability that allows for remote code execution.",DrayTek,Multiple Vigor Routers
CVE-2018-7600,9.8,0.94489,0.99999,"Drupal Core contains a remote code execution vulnerability that could allow an attacker to exploit multiple attack vectors on a Drupal site, resulting in complete site compromise.",Drupal,Drupal Core
CVE-2021-22205,10.0,0.94479,0.99997,"GitHub Community and Enterprise Editions that utilize the ability to upload images through GitLab Workhorse are vulnerable to remote code execution. Workhorse passes image file extensions through ExifTool, which improperly validates the image files.",GitLab,Community and Enterprise Editions
CVE-2018-6789,9.8,0.74459,0.98758,Exim contains a buffer overflow vulnerability in the base64d function part of the SMTP listener that may allow for remote code execution.,Exim,Exim
CVE-2020-8657,9.8,0.86143,0.99328,"EyesOfNetwork contains a use of hard-coded credentials vulnerability, as it uses the same API key by default. Exploitation allows an attacker to calculate or guess the admin access token.",EyesOfNetwork,EyesOfNetwork
CVE-2020-8655,7.8,0.89916,0.99528,EyesOfNetwork contains an improper privilege management vulnerability that may allow a user to run commands as root via a crafted Nmap Scripting Engine (NSE) script to nmap7.,EyesOfNetwork,EyesOfNetwork
CVE-2020-5902,9.8,0.94442,0.99987,F5 BIG-IP Traffic Management User Interface (TMUI) contains a remote code execution vulnerability in undisclosed pages.,F5,BIG-IP
CVE-2021-22986,9.8,0.94485,0.99997,"F5 BIG-IP and BIG-IQ Centralized Management contain a remote code execution vulnerability in the iControl REST interface that allows unauthenticated attackers with network access to execute system commands, create or delete files, and disable services.",F5,BIG-IP and BIG-IQ Centralized Management
CVE-2021-35464,9.8,0.9438,0.99959,"ForgeRock Access Management (AM) Core Server allows an attacker who sends a specially crafted HTTP request to one of three endpoints (/ccversion/Version, /ccversion/Masthead, or /ccversion/ButtonFrame) to execute code in the context of the current user (unless ForgeRock AM is running as root user, which the vendor does not recommend).",ForgeRock,Access Management (AM)
CVE-2019-5591,6.5,0.01513,0.80174,Fortinet FortiOS contains a default configuration vulnerability that may allow an unauthenticated attacker on the same subnet to intercept sensitive information by impersonating the Lightweight Directory Access Protocol (LDAP) server.,Fortinet,FortiOS
CVE-2020-12812,9.8,0.50318,0.9765,Fortinet FortiOS SSL VPN contains an improper authentication vulnerability that may allow a user to login successfully without being prompted for the second factor of authentication (FortiToken) if they change the case in their username.,Fortinet,FortiOS
CVE-2018-13379,9.8,0.94473,0.99995,Fortinet FortiOS SSL VPN web portal contains a path traversal vulnerability that may allow an unauthenticated attacker to download FortiOS system files through specially crafted HTTP resource requests.,Fortinet,FortiOS
CVE-2020-16010,8.8,0.2354,0.95616,"Google Chrome for Android UI contains a heap buffer overflow vulnerability that allows a remote attacker, who has compromised the renderer process, to potentially perform a sandbox escape via a crafted HTML page.",Google,Chrome for Android UI
CVE-2020-15999,9.6,0.93154,0.9978,"Google Chrome uses FreeType, an open-source software library to render fonts, which contains a heap buffer overflow vulnerability in the function Load_SBit_Png when processing PNG images embedded into fonts. This vulnerability is part of an exploit chain with CVE-2020-17087 on Windows and CVE-2020-16010 on Android.",Google,Chrome FreeType
CVE-2021-21166,8.8,0.41931,0.97216,"Google Chromium contains a race condition vulnerability that allows a remote attacker to potentially exploit heap corruption via a crafted HTML page. This vulnerability could affect multiple web browsers that utilize Chromium, including, but not limited to, Google Chrome, Microsoft Edge, and Opera.",Google,Chromium
CVE-2020-16017,9.6,0.2193,0.95387,"Google Chrome contains a use-after-free vulnerability that allows a remote attacker, who has compromised the renderer process, to potentially perform a sandbox escape via a crafted HTML page.  ",Google,Chrome
CVE-2021-37976,6.5,0.11944,0.93331,"Google Chromium contains an information disclosure vulnerability within the core memory component that allows a remote attacker to obtain potentially sensitive information from process memory via a crafted HTML page. This vulnerability could affect multiple web browsers that utilize Chromium, including, but not limited to, Google Chrome, Microsoft Edge, and Opera.",Google,Chromium
CVE-2020-16009,8.8,0.82198,0.99149,"Google Chromium V8 Engine contains a type confusion vulnerability that allows a remote attacker to potentially exploit heap corruption via a crafted HTML page. This vulnerability could affect multiple web browsers that utilize Chromium, including, but not limited to, Google Chrome, Microsoft Edge, and Opera.",Google,Chromium V8
CVE-2021-30632,8.8,0.83252,0.99195,"Google Chromium V8 Engine contains an out-of-bounds write vulnerability that allows a remote attacker to potentially exploit heap corruption via a crafted HTML page. This vulnerability could affect multiple web browsers that utilize Chromium, including, but not limited to, Google Chrome, Microsoft Edge, and Opera.",Google,Chromium V8
