CVE,CVSS3,EPSS,EPSS Percentile,Description,Vendor,Product
CVE-2023-4762,8.8,0.11497,0.9319,"Google Chromium V8 contains a type confusion vulnerability that allows a remote attacker to execute code via a crafted HTML page. This vulnerability could affect multiple web browsers that utilize Chromium, including, but not limited to, Google Chrome, Microsoft Edge, and Opera.",Google,Chromium V8
CVE-2022-48618,7.0,0.0018,0.40289,"Apple iOS, iPadOS, macOS, tvOS, and watchOS contain a time-of-check/time-of-use (TOCTOU) memory corruption vulnerability that allows an attacker with read and write capabilities to bypass Pointer Authentication.",Apple,Multiple Products
CVE-2024-21893,8.2,0.9432,0.99936,"Ivanti Connect Secure (ICS, formerly known as Pulse Connect Secure), Ivanti Policy Secure, and Ivanti Neurons contain a server-side request forgery (SSRF) vulnerability in the SAML component that allows an attacker to access certain restricted resources without authentication.",Ivanti,"Connect Secure, Policy Secure, and Neurons"
CVE-2023-22527,9.8,0.94363,0.99951,Atlassian Confluence Data Center and Server contain an unauthenticated OGNL template injection vulnerability that can lead to remote code execution.,Atlassian,Confluence Data Center and Server
CVE-2024-23222,8.8,0.00134,0.34415,"Apple iOS, iPadOS, macOS, tvOS, and Safari WebKit contain a type confusion vulnerability that leads to code execution when processing maliciously crafted web content. This vulnerability could impact HTML parsers that use WebKit, including but not limited to Apple Safari and non-Apple products which rely on WebKit for HTML processing.",Apple,Multiple Products
CVE-2023-34048,9.8,0.91736,0.99651,VMware vCenter Server contains an out-of-bounds write vulnerability in the implementation of the DCERPC protocol that allows an attacker to conduct remote code execution.,VMware,vCenter Server
CVE-2023-35082,9.8,0.94468,0.99993,Ivanti Endpoint Manager Mobile (EPMM) and MobileIron Core contain an authentication bypass vulnerability that allows unauthorized users to access restricted functionality or resources of the application.,Ivanti,Endpoint Manager Mobile (EPMM) and MobileIron Core
CVE-2024-0519,8.8,0.00211,0.43825,"Google Chromium V8 Engine contains an out-of-bounds memory access vulnerability that allows a remote attacker to potentially exploit heap corruption via a crafted HTML page. This vulnerability could affect multiple web browsers that utilize Chromium, including, but not limited to, Google Chrome, Microsoft Edge, and Opera.",Google,Chromium V8
CVE-2023-6549,7.5,0.18713,0.94893,"Citrix NetScaler ADC and NetScaler Gateway contain a buffer overflow vulnerability that allows for a denial-of-service when configured as a Gateway (VPN virtual server, ICA Proxy, CVPN, RDP Proxy) or AAA virtual server.",Citrix,NetScaler ADC and NetScaler Gateway
CVE-2023-6548,8.8,0.1152,0.93195,"Citrix NetScaler ADC and NetScaler Gateway contain a code injection vulnerability that allows for authenticated remote code execution on the management interface with access to NSIP, CLIP, or SNIP.",Citrix,NetScaler ADC and NetScaler Gateway
CVE-2018-15133,8.1,0.7999,0.99026,"Laravel Framework contains a deserialization of untrusted data vulnerability, allowing for remote command execution. This vulnerability may only be exploited if a malicious user has accessed the application encryption key (APP_KEY environment variable).",Laravel,Laravel Framework
CVE-2023-29357,9.8,0.94356,0.99948,"Microsoft SharePoint Server contains an unspecified vulnerability that allows an unauthenticated attacker, who has gained access to spoofed JWT authentication tokens, to use them for executing a network attack. This attack bypasses authentication, enabling the attacker to gain administrator privileges.",Microsoft,SharePoint Server
CVE-2023-46805,8.2,0.94398,0.99968,"Ivanti Connect Secure (ICS, formerly known as Pulse Connect Secure) and Ivanti Policy Secure gateways contain an authentication bypass vulnerability in the web component that allows an attacker to access restricted resources by bypassing control checks. This vulnerability can be leveraged in conjunction with CVE-2024-21887, a command injection vulnerability.",Ivanti,Connect Secure and Policy Secure
CVE-2024-21887,9.1,0.94416,0.99974,"Ivanti Connect Secure (ICS, formerly known as Pulse Connect Secure) and Ivanti Policy Secure contain a command injection vulnerability in the web components of these products, which can allow an authenticated administrator to send crafted requests to execute code on affected appliances. This vulnerability can be leveraged in conjunction with CVE-2023-46805, an authenticated bypass issue.",Ivanti,Connect Secure and Policy Secure
CVE-2023-23752,5.3,0.94527,1.0,Joomla! contains an improper access control vulnerability that allows unauthorized access to webservice endpoints.,Joomla!,Joomla!
CVE-2016-20017,9.8,0.88496,0.99447,"D-Link DSL-2750B devices contain a command injection vulnerability that allows remote, unauthenticated command injection via the login.cgi cli parameter.",D-Link,DSL-2750B Devices
CVE-2023-41990,7.8,0.04103,0.8795,"Apple iOS, iPadOS, macOS, tvOS, and watchOS contain an unspecified vulnerability that allows for code execution when processing a font file.",Apple,Multiple Products
CVE-2023-27524,9.8,0.80409,0.99047,Apache Superset contains an insecure default initialization of a resource vulnerability that allows an attacker to authenticate and access unauthorized resources on installations that have not altered the default configured SECRET_KEY according to installation instructions.,Apache,Superset
CVE-2023-29300,9.8,0.92907,0.9975,Adobe ColdFusion contains a deserialization of untrusted data vulnerability that allows for code execution.,Adobe,ColdFusion
CVE-2023-38203,,0.94264,0.99922,Adobe ColdFusion contains a deserialization of untrusted data vulnerability that allows for code execution.,Adobe,ColdFusion
CVE-2023-7101,7.8,0.89075,0.99479,"Spreadsheet::ParseExcel contains a remote code execution vulnerability due to passing unvalidated input from a file into a string-type “eval”. Specifically, the issue stems from the evaluation of Number format strings within the Excel parsing logic.",Spreadsheet::ParseExcel,Spreadsheet::ParseExcel
CVE-2023-7024,8.8,0.01632,0.80868,"Google Chromium WebRTC, an open-source project providing web browsers with real-time communication, contains a heap buffer overflow vulnerability that allows a remote attacker to potentially exploit heap corruption via a crafted HTML page. This vulnerability could impact web browsers using WebRTC, including but not limited to Google Chrome.",Google,Chromium WebRTC
CVE-2023-49897,8.8,0.31328,0.96472,FXC AE1021 and AE1021PE contain an OS command injection vulnerability that allows authenticated users to execute commands via a network.,FXC,"AE1021, AE1021PE"
CVE-2023-47565,8.8,0.80482,0.99052,QNAP VioStar NVR contains an OS command injection vulnerability that allows authenticated users to execute commands via a network.,QNAP,VioStor NVR
CVE-2023-6448,9.8,0.10289,0.92704,"Unitronics Vision Series PLCs and HMIs ship with an insecure default password, which if left unchanged, can allow attackers to execute remote commands.",Unitronics,Vision PLC and HMI
CVE-2023-41266,6.5,0.94246,0.99915,"Qlik Sense contains a path traversal vulnerability that allows a remote, unauthenticated attacker to create an anonymous session by sending maliciously crafted HTTP requests. This anonymous session could allow the attacker to send further requests to unauthorized endpoints.",Qlik,Sense
CVE-2023-41265,9.9,0.91791,0.99655,Qlik Sense contains an HTTP tunneling vulnerability that allows an attacker to escalate privileges and execute HTTP requests on the backend server hosting the software.,Qlik,Sense
CVE-2023-33107,7.8,0.00067,0.21271,Multiple Qualcomm chipsets contain an integer overflow vulnerability due to memory corruption in Graphics Linux while assigning shared virtual memory region during IOCTL call.,Qualcomm,Multiple Chipsets
CVE-2023-33106,7.8,0.00043,0.12855,Multiple Qualcomm chipsets contain a use of out-of-range pointer offset vulnerability due to memory corruption in Graphics while submitting a large list of sync points in an AUX command to the IOCTL_KGSL_GPU_AUX_COMMAND.,Qualcomm,Multiple Chipsets
CVE-2023-33063,7.8,0.00227,0.45565,Multiple Qualcomm chipsets contain a use-after-free vulnerability due to memory corruption in DSP Services during a remote call from HLOS to DSP.,Qualcomm,Multiple Chipsets
CVE-2022-22071,7.8,0.00654,0.69672,Multiple Qualcomm chipsets contain a use-after-free vulnerability when process shell memory is freed using IOCTL munmap call and process initialization is in progress.,Qualcomm,Multiple Chipsets
CVE-2023-42917,8.8,0.0004,0.11632,"Apple iOS, iPadOS, macOS, and Safari WebKit contain a memory corruption vulnerability that leads to code execution when processing maliciously crafted web content. This vulnerability could impact HTML parsers that use WebKit, including but not limited to Apple Safari and non-Apple products which rely on WebKit for HTML processing.",Apple,Multiple Products
CVE-2023-42916,6.5,0.00046,0.13671,"Apple iOS, iPadOS, macOS, and Safari WebKit contain an out-of-bounds read vulnerability that may disclose sensitive information when processing maliciously crafted web content. This vulnerability could impact HTML parsers that use WebKit, including but not limited to Apple Safari and non-Apple products which rely on WebKit for HTML processing.",Apple,Multiple Products
CVE-2023-6345,9.6,0.00305,0.53054,"Google Chromium Skia contains an integer overflow vulnerability that allows a remote attacker, who has compromised the renderer process, to potentially perform a sandbox escape via a malicious file. This vulnerability affects Google Chrome and ChromeOS, Android, Flutter, and possibly other products.",Google,Chromium Skia
CVE-2023-49103,7.5,0.94366,0.99953,"ownCloud graphapi contains an information disclosure vulnerability that can reveal sensitive data stored in phpinfo() via GetPhpInfo.php, including administrative credentials.",ownCloud,ownCloud graphapi
CVE-2023-4911,7.8,0.64597,0.98315,"GNU C Library's dynamic loader ld.so contains a buffer overflow vulnerability when processing the GLIBC_TUNABLES environment variable, allowing a local attacker to execute code with elevated privileges.",GNU,GNU C Library
CVE-2023-36584,5.4,0.20094,0.95112,Microsoft Windows Mark of the Web (MOTW) contains a security feature bypass vulnerability resulting in a limited loss of integrity and availability of security features.,Microsoft,Windows
CVE-2023-1671,9.8,0.94317,0.99935,Sophos Web Appliance contains a command injection vulnerability in the warn-proceed handler that allows for remote code execution.,Sophos,Web Appliance
CVE-2020-2551,9.8,0.94393,0.99965,Oracle Fusion Middleware contains an unspecified vulnerability in the WLS Core Components that allows an unauthenticated attacker with network access via IIOP to compromise the WebLogic Server.,Oracle,Fusion Middleware
CVE-2023-36033,7.8,0.00146,0.36214,Microsoft Windows Desktop Window Manager (DWM) Core Library contains an unspecified vulnerability that allows for privilege escalation.,Microsoft,Windows
CVE-2023-36025,8.8,0.90415,0.99555,Microsoft Windows SmartScreen contains a security feature bypass vulnerability that could allow an attacker to bypass Windows Defender SmartScreen checks and their associated prompts.,Microsoft,Windows
CVE-2023-36036,7.8,0.00968,0.75368,Microsoft Windows Cloud Files Mini Filter Driver contains a privilege escalation vulnerability that could allow an attacker to gain SYSTEM privileges.,Microsoft,Windows
CVE-2023-47246,9.8,0.9438,0.99959,SysAid Server (on-premises version) contains a path traversal vulnerability that leads to code execution.,SysAid,SysAid Server
CVE-2023-36844,5.3,0.94297,0.99927,"Juniper Junos OS on EX Series contains a PHP external variable modification vulnerability that allows an unauthenticated, network-based attacker to control certain, important environment variables. Using a crafted request an attacker is able to modify certain PHP environment variables, leading to partial loss of integrity, which may allow chaining to other vulnerabilities.",Juniper,Junos OS
CVE-2023-36845,9.8,0.94355,0.99948,"Juniper Junos OS on EX Series and SRX Series contains a PHP external variable modification vulnerability that allows an unauthenticated, network-based attacker to control an important environment variable. Using a crafted request, which sets the variable PHPRC, an attacker is able to modify the PHP execution environment allowing the injection und execution of code.",Juniper,Junos OS
CVE-2023-36846,,0.94112,0.99893,"Juniper Junos OS on SRX Series contains a missing authentication for critical function vulnerability that allows an unauthenticated, network-based attacker to cause limited impact to the file system integrity. With a specific request to user.php that doesn't require authentication, an attacker is able to upload arbitrary files via J-Web, leading to a loss of integrity for a certain part of the file system, which may allow chaining to other vulnerabilities.",Juniper,Junos OS
CVE-2023-36847,,0.94112,0.99893,"Juniper Junos OS on EX Series contains a missing authentication for critical function vulnerability that allows an unauthenticated, network-based attacker to cause limited impact to the file system integrity. With a specific request to installAppPackage.php that doesn't require authentication, an attacker is able to upload arbitrary files via J-Web, leading to a loss of integrity for a certain part of the file system, which may allow chaining to other vulnerabilities.",Juniper,Junos OS
CVE-2023-36851,5.3,0.11073,0.93046,"Juniper Junos OS on SRX Series contains a missing authentication for critical function vulnerability that allows an unauthenticated, network-based attacker to cause limited impact to the file system integrity. With a specific request to webauth_operation.php that doesn't require authentication, an attacker is able to upload arbitrary files via J-Web, leading to a loss of integrity for a certain part of the file system, which may allow chaining to other vulnerabilities.",Juniper,Junos OS
CVE-2023-29552,7.5,0.93709,0.99833,"The Service Location Protocol (SLP) contains a denial-of-service (DoS) vulnerability that could allow an unauthenticated, remote attacker to register services and use spoofed UDP traffic to conduct a denial-of-service (DoS) attack with a significant amplification factor.",IETF,Service Location Protocol (SLP)
CVE-2023-22518,9.8,0.94375,0.99956,Atlassian Confluence Data Center and Server contain an improper authorization vulnerability that can result in significant data loss when exploited by an unauthenticated attacker. There is no impact on confidentiality since the attacker cannot exfiltrate any data.,Atlassian,Confluence Data Center and Server
CVE-2023-46604,9.8,0.94436,0.99984,Apache ActiveMQ contains a deserialization of untrusted data vulnerability that may allow a remote attacker with network access to a broker to run shell commands by manipulating serialized class types in the OpenWire protocol to cause the broker to instantiate any class on the classpath.,Apache,ActiveMQ
CVE-2023-46748,8.8,0.03698,0.87277,F5 BIG-IP Configuration utility contains an SQL injection vulnerability that may allow an authenticated attacker with network access through the BIG-IP management port and/or self IP addresses to execute system commands. This vulnerability can be used in conjunction with CVE-2023-46747.,F5,BIG-IP Configuration Utility
CVE-2023-46747,9.8,0.94441,0.99986,F5 BIG-IP Configuration utility contains an authentication bypass using an alternate path or channel vulnerability due to undisclosed requests that may allow an unauthenticated attacker with network access to the BIG-IP system through the management port and/or self IP addresses to execute system commands. This vulnerability can be used in conjunction with CVE-2023-46748.,F5,BIG-IP Configuration Utility
CVE-2023-5631,5.4,0.9074,0.99577,Roundcube Webmail contains a persistent cross-site scripting (XSS) vulnerability that allows a remote attacker to run malicious JavaScript code.,Roundcube,Webmail
CVE-2023-20273,7.2,0.92717,0.99732,"Cisco IOS XE contains a command injection vulnerability in the web user interface. When chained with CVE-2023-20198, the attacker can leverage the new local user to elevate privilege to root and write the implant to the file system. Cisco identified CVE-2023-20273 as the vulnerability exploited to deploy the implant. CVE-2021-1435, previously associated with the exploitation events, is no longer believed to be related to this activity.",Cisco,Cisco IOS XE Web UI
CVE-2023-4966,7.5,0.94378,0.99957,"Citrix NetScaler ADC and NetScaler Gateway contain a buffer overflow vulnerability that allows for sensitive information disclosure when configured as a Gateway (VPN virtual server, ICA Proxy, CVPN, RDP Proxy) or AAA virtual server.",Citrix,NetScaler ADC and NetScaler Gateway
CVE-2023-20198,10.0,0.94349,0.99946,"Cisco IOS XE Web UI contains a privilege escalation vulnerability in the web user interface that could allow a remote, unauthenticated attacker to create an account with privilege level 15 access. The attacker can then use that account to gain control of the affected device.",Cisco,IOS XE Web UI
CVE-2023-21608,7.8,0.89414,0.99499,Adobe Acrobat and Reader contains a use-after-free vulnerability that allows for code execution in the context of the current user.,Adobe,Acrobat and Reader
CVE-2023-20109,6.6,0.00879,0.74085,"Cisco IOS and IOS XE contain an out-of-bounds write vulnerability in the Group Encrypted Transport VPN (GET VPN) feature that could allow an authenticated, remote attacker who has administrative control of either a group member or a key server to execute malicious code or cause a device to crash.",Cisco,IOS and IOS XE
CVE-2023-41763,,0.19791,0.9507,Microsoft Skype for Business contains an unspecified vulnerability that allows for privilege escalation.,Microsoft,Skype for Business
CVE-2023-36563,5.5,0.00745,0.71736,Microsoft WordPad contains an unspecified vulnerability that allows for information disclosure.,Microsoft,WordPad
CVE-2023-44487,7.5,0.94486,0.99998,HTTP/2 contains a rapid reset vulnerability that allows for a distributed denial-of-service attack (DDoS).,IETF,HTTP/2
CVE-2023-22515,9.8,0.94365,0.99952,Atlassian Confluence Data Center and Server contains a broken access control vulnerability that allows an attacker to create unauthorized Confluence administrator accounts and access Confluence.,Atlassian,Confluence Data Center and Server
CVE-2023-40044,8.8,0.94427,0.99979,Progress WS_FTP Server contains a deserialization of untrusted data vulnerability in the Ad Hoc Transfer module that allows an authenticated attacker to execute remote commands on the underlying operating system.,Progress,WS_FTP Server
CVE-2023-42824,7.8,0.00494,0.64387,Apple iOS and iPadOS contain an unspecified vulnerability that allows for local privilege escalation.,Apple,iOS and iPadOS
CVE-2023-42793,9.8,0.94584,1.0,JetBrains TeamCity contains an authentication bypass vulnerability that allows for remote code execution on TeamCity Server.,JetBrains,TeamCity
CVE-2023-28229,7.0,0.07065,0.90975,Microsoft Windows Cryptographic Next Generation (CNG) Key Isolation Service contains an unspecified vulnerability that allows an attacker to gain specific limited SYSTEM privileges.,Microsoft,Windows CNG Key Isolation Service
CVE-2023-4211,5.5,0.00034,0.08599,"Arm Mali GPU Kernel Driver contains a use-after-free vulnerability that allows a local, non-privileged user to make improper GPU memory processing operations to gain access to already freed memory.",Arm,Mali GPU Kernel Driver
CVE-2023-5217,8.8,0.01748,0.8149,"Google Chromium libvpx contains a heap buffer overflow vulnerability in vp8 encoding that allows a remote attacker to potentially exploit heap corruption via a crafted HTML page. This vulnerability could impact web browsers using libvpx, including but not limited to Google Chrome.",Google,Chromium libvpx
CVE-2018-14667,9.8,0.88444,0.99444,"Red Hat JBoss RichFaces Framework contains an expression language injection vulnerability via the UserResource resource. A remote, unauthenticated attacker could exploit this vulnerability to execute malicious code using a chain of Java serialized objects via org.ajax4jsf.resource.UserResource$UriData.",Red Hat,JBoss RichFaces Framework
CVE-2023-41991,5.5,0.06198,0.90306,"Apple iOS, iPadOS, macOS, and watchOS contain an improper certificate validation vulnerability that can allow a malicious app to bypass signature validation.",Apple,Multiple Products
CVE-2023-41992,7.8,0.00447,0.62301,"Apple iOS, iPadOS, macOS, and watchOS contain an unspecified vulnerability that allows for local privilege escalation.",Apple,Multiple Products
CVE-2023-41993,8.8,0.08736,0.91984,"Apple iOS, iPadOS, macOS, and Safari WebKit contain an unspecified vulnerability that leads to code execution when processing maliciously crafted web content. This vulnerability could impact HTML parsers that use WebKit, including but not limited to Apple Safari and non-Apple products which rely on WebKit for HTML processing.",Apple,Multiple Products
CVE-2023-41179,7.2,0.02376,0.84059,Trend Micro Apex One and Worry-Free Business Security contain an unspecified vulnerability in the third-party anti-virus uninstaller that could allow an attacker to manipulate the module to conduct remote code execution. An attacker must first obtain administrative console access on the target system in order to exploit this vulnerability.,Trend Micro,Apex One and Worry-Free Business Security
CVE-2023-28434,8.8,0.33706,0.96666,"MinIO contains a security feature bypass vulnerability that allows an attacker to use crafted requests to bypass metadata bucket name checking and put an object into any bucket while processing `PostPolicyBucket` to conduct privilege escalation. To carry out this attack, the attacker requires credentials with `arn:aws:s3:::*` permission, as well as enabled Console API access.",MinIO,MinIO
CVE-2022-22265,7.8,0.00211,0.43842,Samsung devices with selected Exynos chipsets contain a use-after-free vulnerability that allows malicious memory write and code execution.,Samsung,Mobile Devices
CVE-2021-3129,9.8,0.94287,0.99926,Laravel Ignition contains a file upload vulnerability that allows unauthenticated remote attackers to execute malicious code due to insecure usage of file_get_contents() and file_put_contents().,Laravel,Ignition
CVE-2023-26369,7.8,0.00316,0.53952,Adobe Acrobat and Reader contains an out-of-bounds write vulnerability that allows for code execution.,Adobe,Acrobat and Reader
CVE-2023-35674,7.8,0.00056,0.17511,Android Framework contains an unspecified vulnerability that allows for privilege escalation.,Android,Framework
CVE-2023-20269,9.1,0.00291,0.52021,"Cisco Adaptive Security Appliance and Firepower Threat Defense contain an unauthorized access vulnerability that could allow an unauthenticated, remote attacker to conduct a brute force attack in an attempt to identify valid username and password combinations or establish a clientless SSL VPN session with an unauthorized user.",Cisco,Adaptive Security Appliance and Firepower Threat Defense
CVE-2023-4863,8.8,0.93949,0.99868,Google Chromium WebP contains a heap-based buffer overflow vulnerability that allows a remote attacker to perform an out-of-bounds memory write via a crafted HTML page. This vulnerability can affect applications that use the WebP Codec.,Google,Chromium WebP
CVE-2023-36761,6.5,0.02766,0.85217,Microsoft Word contains an unspecified vulnerability that allows for information disclosure.,Microsoft,Word
CVE-2023-36802,7.8,0.689,0.98508,Microsoft Streaming Service Proxy contains an unspecified vulnerability that allows for privilege escalation.,Microsoft,Streaming Service Proxy
CVE-2023-41064,7.8,0.92522,0.99717,"Apple iOS, iPadOS, and macOS contain a buffer overflow vulnerability in ImageIO when processing a maliciously crafted image, which may lead to code execution. This vulnerability was chained with CVE-2023-41061.",Apple,"iOS, iPadOS, and macOS"
CVE-2023-41061,7.8,0.04104,0.87951,"Apple iOS, iPadOS, and watchOS contain an unspecified vulnerability due to a validation issue affecting Wallet in which a maliciously crafted attachment may result in code execution. This vulnerability was chained with CVE-2023-41064.",Apple,"iOS, iPadOS, and watchOS"
CVE-2023-33246,9.8,0.94426,0.99978,"Several components of Apache RocketMQ, including NameServer, Broker, and Controller, are exposed to the extranet and lack permission verification. An attacker can exploit this vulnerability by using the update configuration function to execute commands as the system users that RocketMQ is running as or achieve the same effect by forging the RocketMQ protocol content.",Apache,RocketMQ
CVE-2023-38831,7.8,0.9373,0.99836,RARLAB WinRAR contains an unspecified vulnerability that allows an attacker to execute code when a user attempts to view a benign file within a ZIP archive.,RARLAB,WinRAR
CVE-2023-32315,7.5,0.94439,0.99986,Ignite Realtime Openfire contains a path traversal vulnerability that allows an unauthenticated attacker to access restricted pages in the Openfire Admin Console reserved for administrative users.,Ignite Realtime,Openfire
CVE-2023-38035,9.8,0.94435,0.99983,"Ivanti Sentry, formerly known as MobileIron Sentry, contains an authentication bypass vulnerability that may allow an attacker to bypass authentication controls on the administrative interface due to an insufficiently restrictive Apache HTTPD configuration.",Ivanti,Sentry
